id,name,edate,ctype,twitter,link,incdate,incnum,cdate,creason,creasonx,ophqcity,ophq,leghqcity,leghq,arbjur,cryptonative,classifier,description,fte,verified,comments
10001,1BTCXE,01/01/2012,Private,@1btcxe,https://1btcxe.com,,,,,A,Panama City,Panama,Panama City,Panama,Panama,Native,"101001001,101011101","Bitcoin Exchange supporting over 30 fiat currencies through partnership with ""Crypto Capital""",,TRUE,
10002,1EX.Trade,08/01/2016,Private,@1extrade,https://1ex.trade/index.php,,,,,,Unidentified,Switzerland,Unidentified,Switzerland,Switzerland,Native,"101001001,101011101",Exchange,,TRUE,
10003,"2014-01-01:""21 Inc."";
2018-04-01:""earn.com""",01/01/2013,Private,@earndotcom,earn.com,01/05/2013,,01/04/2018,Acquired by Coinbase (as earn.com),A,"San Francisco, California",United States,"San Francisco, California",United States,United States,Native,2014-01-01:111301201,"2015-01-01 ""Microtask crypto payment platform""",,TRUE,
10004,247Exchange,01/08/2014,Private,,https://www.247exchange.com/?rId=42128,01/01/2014,IFSC/60/310/IME/14.,,Not clear,R,Unidentified,Unidentified,Belize City,Belize,Belize,Native,2014-01-01:101011100,"2014-01-01 ""Multi-Coin Brokerage Services""",,TRUE,"""hey guys dont use this exchange i have lost 5K here no support no reply"""
10005,37coins,01/12/2013,Private,@37Coins,,27/08/2015,,16/12/2016,Failed to meet market demands and expectations,R,"Sunnyvale, California",United States,"Sunnyvale, California",United States,United States,Native,2013-01-01:121601500,"""Avalon"" Mining Hardware; Cloud Mining",2015-01-01:10,TRUE,
10006,99Bitcoins,01/04/2013,Private,@99BitcoinsHQ,https://99bitcoins.com/,01/01/2013,201843058E,,,,Tel Aviv,Israel,Singapore,Singapore,Singapore,Native,"2013-01-01:111311302;
2018-01-01:111311302,193723801","Bitcoin Education & News, Marketing and advertising services related to cryptocurrenies (2018)",,TRUE,
10007,Abra,01/03/2015,Private,@AbraGlobal,https://www.abra.com,01/01/2014,,,,,"2015-03-01:""Saratoga, California"";
2015-01-01:""Mountain View, California""",United States,"2015-03-01:""Saratoga, California"";
2015-01-01:""Mountain View, California""",United States,United States,Native,"2015-03-01:111311302;
2019-05-29:111311302,101011100","P2P Money Transfer Platform (Remittances) with Bitcoin as back-end (users don't know they're using bitcoins), Mobile App that enables trading equities with crypto.",,TRUE,Parent company: Plutus Technologies Philippines Corporation (Abra International)
10008,Abraxas Market,01/01/2015,Private,@abraxas_market,,01/01/2015,,01/11/2015,"Apparently under heavy DDoS attacks, has not reappeared since.",R,Unidentified,Unidentified,Unidentified,Unidentified,Unidentified,Native,2015-01-01:101011103,"2015-01-01 ""Online Black Marketplace""",,TRUE,"""Abraxas Marketplace is the biggest and the most reliable darknet/deepweb anonymous marketplace at the moment. There you can buy legal or illegal things like drugs, guns, fake money, etc. and receive them at your home by post. The buying process is completely anonymous cause of using the anonymous Tor Browser and paying by internet currency Bitcoin."""
10009,Acacia Trading,01/07/2014,Private,,https://www.tradeacacia.com/,01/01/2014,C3693159,01/01/2017,Discontinued as a paid service and made open source.,R,"Menlo Park, California",United States,"Menlo Park, California",United States,United States,Native,2014-01-01:101001003,"2014-07-01 ""Bitcoin Trading Bot""",2014-01-01:10,,
10010,Agora,01/01/2013,Private,,,01/01/2013,,01/08/2015,"""Temporarily shut down"", but not opened since",R,Unidentified,Unidentified,Unidentified,Unidentified,Unidentified,Native,2013-01-01:101011103,"2013-01-01 ""Online Black Marketplace""",,TRUE,
10011,"2014-01-01:""airBitz"";
2017-10-01:""Edge""
",01/10/2014,Private,@edgewallet,https://edge.app/,01/01/2014,,,,,"San Diego, California",United States,"San Diego, California",United States,United States,Native,"2014-01-01:121611601;
2016-03-01:121611601,121611600","2014-10-01 ""Wallet (AirBitz Bitcoin Wallet)"" ; 
2017-10-01 ""Merchant Directory; Security Development Platform ""The Edge""""",,TRUE,
10012,"2015-04-01:""Align Commerce"";
2017-01-01:""Veem""",01/04/2015,Private,@goveem,https://www.veem.com/,01/02/2014,5971319,,,,"San Francisco, California",United States,"Wilmington, Delaware",United States,United States,Native,111311301,"2014-02-01 ""Payment Processor/B2B Cross-Border Payments for SMB""",,TRUE,
10013,Alpha BTC,01/01/2013,Private,@Alphabtc,https://alphabtc.com/,01/11/2013,"10,186326",,,,"Omaha, Nebraska",United States,"Omaha, Nebraska",United States,United States,Native,"193713700, 193713702, 102011200","Consulting Services; Education and Training, Bitcoin ATM provider - largest in the US Midwest",,TRUE,
10014,Alpha Virtual,01/01/2015,,,,01/01/2015,,,,R,Unidentified,Unidentified,Unidentified,Unidentified,Unidentified,Native,101001000,Multi-Coin Exchange,,TRUE,
10015,AlphaBay,01/12/2014,Private,,,01/09/2014,,01/07/2017,Seized and closed by Multinational Law Enforcement,R,Unidentified,Unidentified,Unidentified,Unidentified,Unidentified,Native,101011103,Online Black Market,,TRUE,
10016,AlphaPoint,01/01/2013,Private,@AlphaPointLive,https://alphapoint.com/,13/03/2012,4215676,,,,"New York, New York",United States,"New York, New York",United States,United States,Native,183403301,"White Label Exchange Technology Platform Provider (Software) for over 20 bitcoin exchanges; in 2015 partial pivot when offering ""Streamcore"", a permissioned blockchain platform for financial services. Also offers ""Remarketer"", a tool for providing participating exchanges with liquidity. Also offers a way to tokenize illiquid assets.",60,TRUE,
10017,Alydian,01/08/2013,Private,@AlydianCo,,01/01/2013,,01/11/2013,"Declared bankruptcy after only 3 months, lost over $4 million",R,"Portland, Oregon",United States,"Bainbridge Island, Washington",United States,United States,Native,131901703,Cloud Mining,,TRUE,First (and last I believe) company to be started by incubator CoinLab
10018,Andromeda,01/04/2014,Private,,,01/04/2014,,01/11/2014,"Shut down, probably exit scam",R,Unidentified,Unidentified,Unidentified,Unidentified,Unidentified,Native,101011103,Online Black Market,,TRUE,"Run by admins of ""DarkBay"" after site was shut down"
10019,Andromeda Exchange,01/08/2019,Private,@mergecommit,https://www.andromeda.exchange/,01/07/2018,,,,,Pasig City,Philippines,Pasig City,Philippines,Philippines,Native,183403301,Whitelabel Crypto Exchange Builders.,,TRUE,Subsidiary of Mergecommit.com
10022,Aquifer,01/01/2014,Private,,,01/01/2014,,01/02/2015,Filed for bankruptcy,R,"Sunnyvale, California",United States,"Sunnyvale, California",United States,United States,Native,131901702,Mining Datacenter,,TRUE,
10023,Armory,01/01/2011,Private,@armory,https://www.bitcoinarmory.com/,01/01/2011,W15152689,,,,"Baltimore, Maryland",United States,"Baltimore, Maryland",United States,United States,Native,"121601500,193713700",Wallet; Consultancy (2015?),,TRUE,
10024,ArtaBit,01/01/2013,Private,@artabitcoins,http://www.artabit.com/sell.html,01/01/2013,,01/01/2015,No information since August 2015,R,Jakarta,Indonesia,Jakarta,Indonesia,,Native,"111311302,111301200","Payment Processor; Remittances; ""Pay with bitcoins anywhere"" Facilitator",,TRUE,
10025,Ascribe,01/02/2015,Private,@ascribeIO,,01/08/2014,HRB 160856,14/08/2018,"Closed operations 2017, team went on to found Ocean Protocol",R,Berlin,Germany,Berlin,Germany,Germany,Native,183403300,"Digital Works Registering and Ownership Tracking ""Ownership Layer of the Internet"" (Bitcoin Anchoring)",,TRUE,
10026,ASICMiner,01/02/2013,Private,@ASIC__miner,https://asicminer.co,01/01/2012,,,,,Shenzhen,China,Shenzhen,China,China,Native,"131901700,131901703",Mining Hardware Manufacturer; Cloud Mining,,TRUE,
10027,Athena Bitcoin,01/08/2015,Private,@AthenaBitcoin,https://www.athenabitcoin.com/,01/01/2015,,,,,"Chicago, Illinois",United States,"Chicago, Illinois",United States,United States,Native,102011200,"2015-01-01 ""Pan American Bitcoin ATM Operator""",,TRUE,
10028,Atlantis,01/06/2013,Private,,,01/03/2013,,01/09/2013,"Shut down by administrators for ""security reasons""",R,Unidentified,Unidentified,Unidentified,Unidentified,Unidentified,Native,101011103,Online Black Market,,TRUE,
10029,Bahtcoin,01/01/2011,Private,,,01/01/2011,,01/01/2014,Likely due to Thai regulation on cryptocurrencies,R,Bangkok,Thailand,Bangkok,Thailand,Thailand,Native,"101001000,101011100","Exchange, Brokerage Services",,TRUE,
10032,Binance,01/07/2017,Private,@Binance,binance.com,01/07/2017,,,,,"2017-07-01:""Hong Kong"";
2017-09-01:""Tokyo"";
2018-03-23:""Valetta""","2017-07-01:""Hong Kong"";
2017-09-01:""Japan"";
2018-03-23:""Malta""","2017-07-01:""Hong Kong"";
2017-09-01:""Tokyo"";
2018-03-23:""Malta""","2017-07-01:""Hong Kong"";
2017-09-01:""Japan"";
2018-03-23:""Malta""",Malta,Native,"2017-07-01:101001000,214604200;
2018-12-11:101001000,214604200,121611601,214304100,152532500,193713702;
2019-07-11:101001000,214604200,121611601,214304100,152532500,193713702,101001001,183403300,173103000","Largest cryptocurrency exchange by true volume (2017), has an IEO platform, Launchpad (2017), acquired trustwallet, a software wallet (2017), opened a research arm, Binance info (2018), an investment arm, Binance Labs, an education arm, Binance academy (2018), a DEX (2019, and lending capability (2019)",,TRUE,
10033,BIPS,01/07/2011,Private,,,01/07/2011,"28,595,867.00",01/05/2014,"Acquired by ""Coinify""",A,Copenhagen,Denmark,Copenhagen,Denmark,Denmark,Native,"111301200,121601500","Payment Processor, Online Wallet",,TRUE,
10034,Bit Innovate,01/08/2012,Private,,,01/01/2012,,24/06/2013,"No activity since end of November 2013, so considered bankrupt",R,Sydney,Australia,Sydney,Australia,Australia,Native,101011100,Bitcoin Brokerage Services; Bitcoin-only Shop (2013),,TRUE,
10035,Bit2Me,01/01/2015,Private,@bit2me,https://bit2me.com/,01/01/2014,"54,835,301.00",,,,"Elche, Alicante",Spain,"Elche, Alicante",Spain,Spain,Native,"101011100,102011200","2014-01-01 ""Brokerage Services; Bitcoin-to-Cash Service via local ATMs""",,TRUE,
10036,Bit4X,01/10/2012,Private,,,01/01/2012,,01/01/2015,"Website isn't working correctly since end of 2015, users claiming it's been a scam",R,Pretoria,South Africa,Pretoria,South Africa,South Africa,Native,101011100,Brokerage services,,TRUE,
10037,Bitaccess,01/01/2014,Private,@bitaccess,https://bitaccess.ca/,01/11/2013,"823,256,235.00",,,,"Ottawa, Ontario",Canada,"Ottawa, Ontario",Canada,Canada,Native,"2014-01-01:102011200;
2017-01-01:102011200,101001000,101001002;
2018-01-01:102011200,101001000,101001002,101011100,121611601,183403300,193703603","Bitcoin ATM Manufacturer, Portfolio Platform (12.2017 Faast), Bitcoin brokerage (2018-02-23 Buy Bitcoin Canada ), Blockchain software suite (2018-01-01 Catena), Enterprise Wallet, KYC, Smart Contracts",,TRUE,"Other subsidiary:DNABC, INC"
10038,Bitalo,01/11/2013,Private,@bitaloag,https://bitalo.de/,01/01/2013,HRB 63772,,,,"Konstanz, Baden Wurtenberg",Germany,"Konstanz, Baden Wurtenberg",Germany,Germany,Native,"2013-01-01:121601500,102011103;
2014-01-01:121601500,102011103,193713702,131901705;
2016-01-01:121601500,102011103,193713702,131901705,101011101","Bitcoin Platform with Multi-Sig Wallet (service doesn't hold users' keys); P2P marketplace; Educational Content (2014); Mining Pool (2014, 2015 not included). Launch of fully-integrated 2.0 platform in January 2016, additionally offering escrow services and a marketplace for user services.",,TRUE,
10040,BitBay,01/02/2014,Private,@BitBay,https://bitbay.net/pl,01/01/2014,C 86244,,,,Katowice,Poland,"2014-02-01:""Katowice"";
2018-01-01:""Valetta""","2014-02-01:""Poland"";
2018-01-01:""Malta""",Malta,Native,"2014-02-01:101001000;
2018-08-02:101001000,214604201;
2018-12-01:101001000,214604201,111301200;
2019-02-01:101001000,214604201,111301200,101011101","Bitcoin & Litecoin Exchange, Stablecoin Issuer, OTC (2019-02-01), Merchant services (2018-12-01) , Crowdfunding STO (2018-08-02)","2016-01-01:15;
2017-01-01:50;
2018-01-01:100",TRUE,
10041,BitBet,01/01/2013,Private,,http://www.bitbet.com/,01/01/2013,,,,,San Jose,Costa Rica,San Jose,Costa Rica,Costa Rica,Native,162822805,Bitcoin Prediction Market/Betting Site,,TRUE,
10042,BitBills,01/05/2011,Private,,http://bitbills.com/,01/01/2011,,15/05/2012,"""No longer in operation""",R,Unidentified,Unidentified,Unidentified,Unidentified,Unidentified,Native,111301204,Physical bitcoins in plastic card format,,TRUE,
10043,Bitbond,01/07/2013,Private,@Bitbond,https://www.bitbond.com/,01/06/2013,HRB 146980,,,,Berlin,Germany,Berlin,Germany,Germany,Native,173103000,"P2P Lending Platform, specifically offers small business financing",,TRUE,
10047,Bitcoil,01/04/2011,Private,,,01/01/2011,,01/01/2013,"Website says that they need to shut down to get ""legal issues in order"", fraud accusations",R,Unidentified,Israel,Unidentified,Israel,Israel,Native,101011100,Brokerage Services (BTC/Shekel),,TRUE,"Bitcoil is down for maintenance. We are working on building the legal, financial, technical and operational infrastructure required to handle the greatly increased demand."
10048,Bitcoin Blender,01/01/2014,Private,,https://bitcoin-blender.com/,01/01/2014,,,,,Unidentified,Unidentified,Unidentified,Unidentified,Unidentified,Native,204024100,Bitcoin Tumbler/Mixing Service,,TRUE,"Occasionally scam accusations, but still seems to work."
10050,Bitcoin Brasil,01/04/2011,Private,,,01/01/2011,,01/12/2013,no activity since then,R,Unidentified,Brazil,Unidentified,Brazil,Brazil,Native,101001000,Exchange,,TRUE,
10051,Bitcoin Capital,01/04/2015,Private,@BTC_Capital,http://www.bitcoincapital.io/,01/01/2015,,,,,Unidentified,Unidentified,George Town,Cayman Islands,Cayman Islands,Native,214304100,Investment Fund managed by Max Keiser and Simon Dixon.,,TRUE,
10052,Bitcoin Fog,01/10/2011,Private,@BitcoinFog,https://bitcoinfog.info/,01/01/2011,,,,,Unidentified,Unidentified,Unidentified,Unidentified,Unidentified,Native,204024100,Bitcoin Tumbler/Mixing Service,,TRUE,"Occasionally scam accusations, but still seems to work"
10053,Bitcoin Foundation,01/12/2012,Foundation,@BTCFoundation,https://bitcoinfoundation.org/,01/12/2012,46-1671796,,,,Washington DC,United States,Washington DC,United States,United States,Native,204014002,Bitcoin Advocacy Group,,TRUE,
10054,Bitcoin Magazine,01/02/2012,Private,@BitcoinMagazine,https://bitcoinmagazine.com,01/01/2012,"5,552,734.00",01/01/2015,"Acquired by ""BTC Media""",A,"Fayetteville, Tennessee",United States,"Wilmington, Delaware",United States,United States,Native,"162812700,162822800","Media/News, Podcast",,TRUE,
10055,Bitcoin Market,17/03/2010,Private,,,,,01/01/2011,"After being blocked by PayPal, probably shut down some months later in the end of 2011 (no sign of activity)",R,Unidentified,Unidentified,Unidentified,Unidentified,Unidentified,Native,101001000,First Bitcoin Exchange,,TRUE,
10056,Bitcoin Nordic,01/04/2012,Private,,,01/01/2012,"32,222,749.00",01/01/2014,"Acquired by ""Coinify""",A,Copenhagen,Denmark,Copenhagen,Denmark,Denmark,Native,101011100,Brokerage services,,TRUE,
10057,Bitcoin of America,01/12/2015,Private,@btcofamerica,https://www.bitcoinofamerica.org/,01/01/2015,,,,,"Chicago, Illinois",United States,"Chigago, Illinois",United States,United States,Native,101011100,Brokerage Services,,TRUE,
10059,"2014-02-01:""Bitcoin.co.id"";
2018-03-14:""Indodax.com""",01/02/2014,Private,@indodax,https://indodax.com/,01/05/2013,,,,,Jakarta,Indonesia,Jakarta,Indonesia,Indonesia,Native,"101001000,101011100",Brokerage Services; Exchange (2014),,TRUE,
10060,Bitcoin.de,01/08/2011,Private,@bitcoin_de,https://www.bitcoin.de,01/01/2011,HRB 13917,,,,Herford,Germany,"Bad Oeynhausen, Nordrhein Westfalen",Germany,Germany,Native,"2011-08-01:102011103;
2013-01-01:102011103,162812700",Marketplace for Buying and Selling bitcoins; News/Blog (2013),,TRUE,Parent company: Bitcoin Group SE
10061,BitcoinAgile,01/01/2014,Private,@bitcoinagile,http://bitcoinagile.com/default,01/01/2014,,,,,"New York, New York",United States,Unidentified,Unidentified,Unidentified,Native,"152512302,152512301","News and Market Data Aggregator, Twitter sentiment tracker",,TRUE,
10062,BitcoinDeals,01/08/2011,Private,,,01/01/2011,,01/08/2012,"Shut down, founders turned away",R,Unidentified,Unidentified,Unidentified,Unidentified,Unidentified,Native,111301202,Proxy-Buyer Service with >300'000 articles,,TRUE,
10063,Bitcoinica,01/09/2011,Private,,,01/01/2011,,01/05/2012,"Got hacked twice in 2012 and lost customer funds (roughly 43,000 BTC)",R,Auckland,New Zealand,Auckland,New Zealand,New Zealand,Native,"101001000,101001002","Exchange, Market Maker",,TRUE,"Original parent company: xWaylab Inc. Acquired by Wendon in 2011-10. Then CORE CREDIT LIMITED becomes the main operator
Source: https://www.google.com/url?sa=t&rct=j&q=&esrc=s&source=web&cd=9&cad=rja&uact=8&ved=2ahUKEwisqrXOgsbkAhXNQUEAHcQSDowQFjAIegQICBAC&url=https%3A%2F%2Fbounty.bitcoin.com%2Fimages%2Fuploads%2Fbitcoinicaoverview.doc&usg=AOvVaw0O1Pt47NAq_WxzxzEB-Z9A"
10064,Bitcoinist.net,01/02/2014,Private,@bitcoinist,https://bitcoinist.com/,01/02/2014,"14,461,555.00",,,,Talinn,Estonia,Talinn,Estonia,Estonia,Native,162812700,Media/News,,TRUE,Parent company: News B Holdings OU
10065,Bitcoinity,01/06/2011,Private,@Bitcoinity,https://bitcoinity.org/,01/01/2011,,,,,Krakow,Poland,,Poland,Poland,Native,"152512301,152512302,152512304","Market Data Site, the leading bitcoin price site from around 2013-2015.",,TRUE,
10069,BitcoinWisdom,01/04/2013,Private,,,01/01/2013,,01/01/2015,"Site is still functional in 2016, but not maintained anymore since summer 2015 --> considered ""abandoned project""",R,Unidentified,Unidentified,Unidentified,Unidentified,Unidentified,Native,152512301,Market Data Site,,,
10070,Bitcorati,01/01/2014,Private,,https://web.archive.org/web/20170224221556/http://bitcorati.com/,01/05/2013,,01/12/2017,Abandoned,R,"Tempe, Arizona",United States,"Tempe, Arizona",United States,United States,Native,"152512300,152522400,162812700",Bitcoin Directory and Rating Platform (until end of 2014); Data and News,,,"Sold in August 2014 to another entrepreneur, still operating"
10071,Bitcurex,01/07/2012,Private,,,01/01/2012,,01/01/2016,"Hacked, lost $1.5MM and shut down in 2016",R,Lodz,Poland,Lodz,Poland,Poland,Native,"101001000,111301204",Exchange; Trading Platform; Prepaid Debit Card,,,
10072,Bitex,01/05/2014,Private,@bitex,https://bitex.la/,01/01/2014,,,,,Buenos Aires,Argentina,Hoofdorp,Netherlands,Netherlands,Native,"2014-05-01:101001000;
2015-01-01:101001000,111311302,111311300,214304100","Exchange; Investment Fund (""Bitkoine"", 2015); Payment Processor and Remittances (2015), Payroll, Custody services",,TRUE,Remittances through partnerships with Western Union and More Money Transfers
10073,Bitfash,01/04/2013,Private,@bitfash,bitfash.com,01/01/2013,,01/11/2014,No information about service since November 2014,R,Melbourne,Australia,Melbourne,Australia,Australia,Native,2013-01-01: 111301202,Middleman Platform to buy fashion items with bitcoin,,,
10074,Bitfarms Ltd,01/10/2017,Public,,https://www.bitfarms.io/,01/06/1981,"729,979,518.00",,Reverse acquisition agreement with Backbone Hosting Solutions Inc in Apr-18,,Quebec,Canada,Toronto,Canada,Canada,Complete pivot,131901704,Mining data centre operator (operated by Backbone since 06/11/2017),,TRUE,"Initially listed on Tel-Aviv Stock Exchange, voluntarily stopped being listed there in 2019, instead listed on the Toronto SE"
10138,Black Market Reloaded,01/01/2011,Private,,,01/01/2011,,01/01/2013,Shut down by administrator (in November),R,Unidentifier,Unidentified,Unidentifier,Unidentified,Unidentified,Native,111301203,Online Black Market,,TRUE,
10139,Bleutrade,01/03/2014,Private,@bleutrade,https://bleutrade.com/,18/10/2018,C 88906,,,,Valletta,Malta,Valletta,"2014-03-01:Brazil;
2018-01-01:Malta",Malta,Native,101001000,Multi-Coin Exchange,,TRUE,
10140,BlinkTrade,01/01/2014,Private,,https://blinktrade.com/,10/11/2014,"4,663,562.00",,,,New York,United States,Delaware,United States,United States,Native,183403300,Open-Source Exchange Technology Platform Provider (Software),2019-08-16:6,TRUE,makes money using a RedHat model and option for infrastructure maintenance
10193,CEX.io,01/01/2013,Private,@cex_io,https://cex.io/,01/01/2013,,,,,Kyiv,Ukraine,London,United Kingdom,,Native,"2013-01-01:131901703;
2014-01-01:101001000;
2016-01-01:101001000,111301200","First Cloud Mining; then pivot towards Exchange and Trading Platform (2014), Wallet and vaul services, Brokerage services, Merchant services","2016-01-01:50;
2017-01-01:90;
2018-01-01:200",TRUE,"Partnership with ""Ghash.io""; customers can mine there and trade/store bitcoins on CEX.io"
10194,Chain,01/01/2014,Private,@chain,https://chain.com/,07/03/2014,C3654340,01/01/2015,Pivot towards enterprise blockchain development platform --> drop of Bitcoin-related activities,P,San Francisco,United States,Delaware,United States,United States,Complete pivot,183403302,"API Platform for Bitcoin Developers (until end of 2015), then pivot towards enterprise blockchain development platform",2019-10-20:50,TRUE,Parent company: Albumatic Inc
10195,Chainalysis,01/01/2014,Private,@chainalysis,https://www.chainalysis.com/,20/04/2015,"5,731,603.00",,,,New York,United States,"Wilmington, Delaware",United States,United States,Native,"152502200,152532500,193703603","Blockchain Intelligence/Compliance, Regular research publication; KYT",2019-08-19:130,TRUE,"Offices also in London, Copenhagen"
10196,Chaincode Labs,01/01/2014,Private,@Chaincodelabs,https://chaincode.com/,06/05/2014,"4,572,985.00",,,,New York,United States,New York,United States,United States,Native,183403302,Research and Contribution to Bitcoin Open-Source Project,2019-08-19:50,TRUE,
10197,ChainPay,01/09/2014,Private,,,30/07/2014,011356V,08/08/2016,Defunct,R,Ramsey,United Kingdom,Ramsey,United Kingdom,Isle of Man,Native,"111301200,111311302",Payment Processor,,TRUE,Parent company:AltXE
10198,ChangeTip,01/12/2013,Private,,,01/01/2013,,18/11/2016,Defunct,R,"San Fransciso, California",United States,Unidentified,Unidentified,Unidentified,Native,"2013-12-01:111321401;
2015-01-01:111321401,101011100;
2015-01-01:111321401,101011100,121611601",Micropayment Platform; Brokerage Services (2015); Wallet (2016) that lets users control their private keys,,TRUE,
10199,Chip Chap,01/01/2015,Private,,,20/10/2015,B12957783,01/09/2018,Seems to be down,R,Les Coves de Vinrom?,Spain,Madrid,Spain,Spain,Native,"101011100,111301202","Bitcoin-to-Cash Service via local bank ATM network, Proxy-buyer",,TRUE,"Unclear when went defunct. Site is down, rumors since May that they are defunct. No social media announcement.
Parent company: Telepay, S.L."
10201,Ciphrex,01/01/2014,Private,@Ciphrex,https://ciphrex.com/,23/04/2014,"5,455,720.00",,,,San Diego,United States,"Wilmington, Delaware",United States,United States,Native,"183403300,121611601","Enterprise-grade Development Platform (""CoinSocket""); Wallet (""mSigna"")",2019-08-22:10,TRUE,
10203,CKPool,01/09/2014,Private,,http://ckpool.org/,01/01/2014,,,,,Unidentified,Unidentified,Unidentified,Unidentified,Unidentified,Native,131901705,Mining Pool,,TRUE,"open source CREATED BY Con Kolivas and Andrew Smith: DescriptionThe GNU General Public License is a widely-used free software license, which guarantees end users the freedom to run, study, share and modify the software."
10204,CleverCoin,01/10/2013,Private,,,01/10/2013,"59,711,124.00",01/07/2016,"Acquired by ""Kraken""",A,Eindhoven,Netherlands,Einfhoven,Netherlands,Netherlands,Native,101001000,Exchange,,,Office in California
10206,Coin Academy,01/09/2014,Private,,https://coinacademy.net/,09/11/2017,"155,657,563.00",,,,Condado del Rey,Panama,Condado del Rey,Panama,Panama,Native,193713702,Education Basic Bitcoin/Altcoin Course,,TRUE,Subsidiary of CETUS TRADING CORP. https://opencorporates.com/companies/pa/155657563
10207,Coin Brief,01/01/2014,Private,,,01/01/2014,,01/09/2015,"Acquired by"" 99Bitcoins""",A,New York,United States,Unidentified,Unidentified,Unidentified,Native,162812700,Digital currency news,,TRUE,"Doesnt seem to have a business model, only a simple website providing tools, created by Steve Wight."
10208,Coin Center,01/09/2014,Private,@coincenter,https://coincenter.org/,11/07/2014,"5,566,908.00",,,,"Washington, D.C.",United States,Delaware,United States,United States,Native,"204014002,193713702",non-profit research and advocacy center and Education,2019-08-22:3,TRUE,
10209,Coin Fire,01/06/2014,Private,,,01/01/2014,201843058E,01/10/2015,"Acquired by ""99Bitcoins""",A,Tel Aviv,Israel,Singapore,Singapore,Singapore,Native,162812700,News,,,
10210,Coin Loft,01/01/2014,Private,@coinloftau,https://www.coinloft.com.au/,17/10/2012,"82,160,820,315.00",,,,"Richmond, Victoria",Australia,"Richmond, Victoria",Australia,Australia,Native,101011100,Brokerage Services,,TRUE,"Founded in 2012, turned towards bitcoin in 2013. Parent company: Global Internet Ventures Pty Ltd"
10211,Coin Republic,01/01/2013,Private,,https://coinrepublic.com/,19/03/2009,200904860H,01/08/2015,"Acquired by ""meXBT""",A,Singapore,Singapore,Singapore,Singapore,Singapore,Native,"2013-01-01:101011100;
2015-08-01:101011100,102011200;
2016-01-01:162812700",Exchange (Brokerage); BTM (08.2015),,TRUE,"https://coinrepublic.com/rnp-compliance.pdf
Parent company: Rapid Net Profits Pte. Ltd."
10213,Coin Validation,01/01/2013,Private,,http://www.coinvalidation.com/,09/10/2013,"4,470,801.00",,,,New York,United States,New York,United States,United States,Native,193703603,Compliance/Verification --> help Bitcoin businesses with AML/KYC,,TRUE,
10304,Earthport,01/01/2016,public,,https://www.earthport.com/about-us/,01/01/1997,,08/05/2019,Acquired by Visa,A,London,United Kingdom,England and Wales,United Kingdom,,Partial pivot,111311302,Cross-border payment services,2019-01-01:200,,"Regional offices in: New York, Miami, San Francisco and Singapore Partnership with Ripple officially announcedin late 2014, fully materialised in Jan 2016. January2016Earthport launched its DLT Gateway (announced in August 2015), an API to connect its customers (bank) to Rippleâ€™s DLT. First test in April 2016.The Earthport Distributed Ledger Gateway transports the funds through the Ripple protocol to record the transaction and leverage its prefunded accounts to provide instant liquidity and the best FX rate. The beneficiary then receives the amount in near real-time"
10397,MatrixVision,18/11/2013,Private,@MatrixVisionBTC,http://www.matrixvision.eu/,05/11/2014,"9,295,837.00",07/10/2016,Defunct,R,,United Kingdom,,United Kingdom,,Native,"193703603,193703604",Compliance Analytics (AML/KYC) Software for Bitcoin Businesses,,TRUE,
10398,"2013-05-01:""McxNOW"";
2016-05-08:""RAWX""",01/05/2013,Private,@mcxnowexchange,https://mcxnow.com/,01/01/2013,,15/12/2016,"Down for maintenance and rebranding (MtMOX), but hasn't reopened since",R,,Unidentified,,Unidentified,,Native,101001000,Multi-Coin Exchange,,TRUE,"Interestingly enough, during the period between McxNOW and RAWX (end of 2014, all 2015) it was referring to btc-e.com"
10399,"2013-01-19:""MegaBigPower"";
2016-01-01:""Giga Watt""",19/01/2013,Private,,https://megabigpower.com,15/12/2016,604 067 749,19/11/2018,Went bankrupt,R,WA,United States,WA,United States,,Native,"131901703,131901704","Proprietary mining, hosted mining",,TRUE,Was One of the largest mines in North America
10400,Melotic,01/01/2014,Private,@MeloticInc,http://melotic.com/,,,15/05/2015,"Shut down due to ""lack of growth"". But considers reopening again with new product",R,,Hong Kong,,Hong Kong,,Native,101001000,Exchange,,TRUE,
10401,meXBT,01/10/2013,Private,@Mexbt,https://www.mexbt.com/,,,14/08/2016,Defunct,R,,Mexico,,Unidentified,,Native,101001000,Exchange,,TRUE,https://twitter.com/Mexbt/status/764277068553084928/photo/1
10402,Mining ASICS Technologies,01/09/2014,Private,,,01/02/2014,,30/12/2014,Declared bankrupt by Dutch Judge on 30th December 2014,R,,Netherlands,,Netherlands,,Native,131901700,Mining Hardware Manufacturer,,TRUE,
10403,Mining Sweden,01/02/2015,Private,@MiningSweden,http://www.miningsweden.se,,,25/05/2016,Defunct or exit scam,R,,Sweden,,Unidentified,,Native,131901703,Cloud Mining,,TRUE,
10404,MintPal,01/02/2014,Private,@MintPalExchange,https://www.mintpal.com/,01/04/2014,"9,009,856.00",13/05/2015,Forced to close after funds stolen by Moolah/Moopay owner; however since then returning some recovered funds. Was acquired by Moolah in July 2014,R,,United Kingdom,,United Kingdom,,Native,101001000,Multi-Coin Exchange,,TRUE,
10405,"2011-01-01:""Vaurum"";
2014-11-12:""Mirrorlabs""",01/01/2011,Private,,https://mirrorx.com/#/home,01/01/2011,,01/01/2017,Pivot away from Bitcoin,R,"Palo Alto, California",United States,California,United States,,Native,101001000,Escrow Exchange and Smart Contracts Trading Platform (until 2014); Pivot towards Smart Contracts and Derivatives Trading Platform allowing to trade private companies (2015),,TRUE,
10406,MonetaGo,01/06/2015,Private,@monetago,https://www.monetago.com/,01/09/2014,,,,,Mumbai,India,NYC,United States,,Native,"183403301,183403300","Application development, sub segment protocols",,TRUE,
10408,Moolah,14/03/2014,Private,,https://moolah.io/,03/03/2014,"8,920,347.00",15/12/2014,Filed for bankruptcy; later turned out that CEO was a scammer who conned the company and its affiliated services,R,,United Kingdom,London,United Kingdom,,Native,"101001000,111301200","Multi-Coin Exchange ""Prelude""; Payment Processor",,TRUE,Formerly mymoneycloud
10410,Mt. Gox,01/07/2010,Private,,,01/07/2010,,01/02/2014,Filed for bankruptcy after losing huge amount of customer funds. Most Famous crypto exchange closure.,R,Tokyo,Japan,Tokyo,Japan,,Native,101001000,Exchange,,TRUE,
10411,MultiBit,01/09/2011,Private,@multibitorg,https://multibit.org/,,603 378 198,27/07/2017,"Acquied by Keepkey, defunct",A,London,United Kingdom,Washington,United States,,Native,121601500,Desktop Wallet,,TRUE,
10413,MyBitcoin,01/01/2010,Private,,http://www.mybitcoin.com/,,,29/07/2011,Got apparently hacked and was shut down,R,,Unidentified,,Unidentified,,Native,121601500,Wallet,,TRUE,49% of user funds returned
10414,Mycelium,01/09/2013,Private,@MyceliumCom,https://wallet.mycelium.com/,07/06/2018,FL-0002.583.592-9,,,,,Unidentified,,Liechtenstein,,Native,"2013-09-01:121611601;
2014-01-01:121611601;
2015-01-01:121611601,111301200,121611602;
2016-01-01:121611601,111301200,121611602,111301204","Wallet; Built-in P2P Exchange (""LocalTrader"", 2014); USB Paper Wallet Creator (""Entropy""); Built-in Payment Processor/Payroll Service (""Gear"", 2015), online and instore merchant ordering and payment system (""Swish""), card (2016)",,TRUE,"Founded in 2008, switched focus to Bitcoin in 2012/13 -- according to their own claim"
10415,MyCoin,01/01/2014,,,,,,09/02/2015,Ponzi-Scheme Scam,R,,Hong Kong,,Unidentified,,Native,"101001000,101001003",Exchange; Trading Platform,,TRUE,"owner disappeared with possibly as much as HK$3bn ($386.9m) in investor funds --> sold ""fake"" (i.e. non-existing) bitcoins, hence no effect on market price when news about the scam came out: However, now it appears it's more around $8-9m that were lost."
10417,NairaEx,01/10/2015,Private,@nairaex,https://www.nairaex.com/,01/01/2015,,,,,,Nigeria,,Unidentified,,Native,101001000,Exchange,,TRUE,
10418,Netcoins,01/01/2015,Private,@netcoins,https://www.netcoins.app/,08/07/2014,"805,024,973.00",,,,Vancouver,Canada,Vacouver,Canada,,Native,101011101,"OTC market for multiple cryptocurrencies, with physical locations in Canada",,TRUE,"Beta launch in autumn 2015, official public launch in January 2016"
10419,Neuroware,01/11/2014,Private,@neurowareio,http://neuroware.io/,01/05/2014,"976,862.00",,,,Kuala Lampur,Malaysia,Kuala Lampur,Malaysia,,Native,"183403300,183403301","Developer Platform/General API Provider (First Product ""Blockstrap"")",,TRUE,
10420,Newnote Financial,01/01/2014,Public,@puretradeexch,http://www.newnote.com/,06/12/2013,,16/11/2016,"Delisted from Canadian Securities Exchange, No evidence of operation",R,Vancouver,Canada,Vancouver,Canada,,Partial pivot,"2014-01-01:101001000,131901703,183403301;
2015-01-01:101011102,111301200","Exchange ""Puretrade"" (integrated with Cointrader.net in 2015); Cloud Mining ""Newnote Miner""; Bitcoin ATM Operator (2015), Pament Processor with ""Coinzero"" PoS software (2015)
Software Development, Puretrade Exchange, Data Centre, Newnote Miner, Bitcoin Point of Sale System (POS), Bitcoin ATM, and Vanity Coins (Custom Crypto Currency)",,TRUE,"Founded in 2010 as ""Winrock Resources Inc"", rebranded in April 2014 and started focusing on Bitcoin and cryptocurrency-related services --> only included from 2014 onwards. Public company traded on stock marketshttp://www.fscwire.com/sites/default/files/news_release_pdf/winrock04082014.pdf"
10421,NewsBTC,01/10/2013,Private,@newsbtc,https://www.newsbtc.com/,,,,,,London,United Kingdom,London,United Kingdom,,Native,162812700,Media,,TRUE,
10422,Nucleus Market,01/10/2014,Private,@nucleus_market,http://nucleusmarket.org,,,13/04/2016,"Collapsed for unknown reasons, taking escrowed coins with it",R,,Unidentified,,Unidentified,,Native,111301203,Online Black Market,,TRUE,
10424,OKCoin,04/09/2013,Private,@okcoin,https://www.okcoin.com/,31/10/2017,C4080221,,,,Beijing,China,California,United States,,Native,"2013-09-04:101001000;
2014-01-01:101001000,101001003,193713701;
2019-01-01:101001000,101001003,214604200","Exchange; Derivatives Platform through the subsidiary OKEx; Side services advisory, trading, fundraising support",217,TRUE,"Has operations in Malta, Hong Kong and Cyprus as well. However, I think the headquarters are in USA. Anton added: according to LinkedIn they are all in Beijing, so I think that their HQ is their"
10425,"2013-07-31:""Mastercoin"";
2015-01-18:""Omni Layer""",31/07/2013,Private,@Omni_layer,https://www.omnilayer.org/,,,,,,,Unidentified,,Unidentified,,Native,"2013-07-31:142201900,183403300;
2015-01-18:142201900,183403300,121601500,152512303",Protocol layer on top of Bitcoin Blockchain enabling asset issuance. Foundation overseeing development and funding.,13,,"Project started in 2012, Foundation was founded in December 2013"
10426,OpenBazaar,01/04/2016,Private,@openbazaar,https://openbazaar.org/,01/04/2015,F1991563,,,,Virginia,United States,Virginia,United States,,Native,"101021201,111301203",Decentralized marketplace for peer-to-peer commerce using cryptocurrency,8,TRUE,
10427,"2015-11-01:""Oraclize"";
2019-03-07:""Provable""",04/11/2015,Private,@provablethings,http://provable.xyz/,18/08/2016,"10,334,939.00",09/05/2019,Acquired by Poseidon Group,A,London,United Kingdom,Wimbledon,United Kingdom,England and Wales,Native,183423500,Provably-honest Oracles Service for smart contracts (Bitcoin and Ethereum),,TRUE,
10428,Orisi,01/06/2014,Private,,https://orisi.org/,01/03/2014,,01/06/2015,"Project is ""on pause"" for some years now",R,,Poland,,,,Native,183423500,Open-Source Distributed Oracle Service for smart contracts on Bitcoin,,TRUE,
10429,Pandora,01/10/2013,Private,,,,,01/11/2014,Exit Scam,R,,,,,,,111301203,Online Black Market,,TRUE,
10430,Paxful,01/06/2014,Private,@paxful,https://paxful.com/,17/07/2015,"5,786,843.00",,,,New York,United States,"Wilmington, Delaware",United States,"Delaware, United States",Native,"2014-06-01:101011103;
2016-04-01:101011103,111301200;
2019-07-01:101011103,111301200,121611601","P2P Marketplace for Buying And Selling bitcoins; Payment Processor (but already discontinued in 2014/15), Merchant services (Pay with Paxful, April 2016), Mobile Wallet (Paxful Bitcoin Wallet App, July 2019)",2019-01-01:100,TRUE,"over 100 employees around the world with offices in New York City USA, Hong Kong, Tallinn Estonia and Manila Philippines"
10432,Paymium,29/12/2010,Private,@paymium,https://www.paymium.com/,01/07/2011,53 326 480 000 012,,,,Paris,France,Boulogne-Billancourt,France,France,Native,"2010-12-29:101001000;
2012-04-06:101001000,121611601;
2013-04-26:101001000;
2014-06-30:101001000,111301200;
2019-01-01:101001000,101001002","Exchange ""Bitcoin-Central.net"" ; Wallet ""Paytunia"" (April 2012, inactive since April 2013); Payment Processor (2014-06-30), Trading platform (October 2018), Market Making (2019 Q1)","2016-01-01:8;
2017-01-01:10;
2018-01-01:15",TRUE,
10433,PeerNova,01/05/2014,Private,@Peernovainc,https://peernova.com/,19/05/2014,"5,521,581.00",17/12/2014,Pivot towards Enterprise Blockchain Solution,P,"San Jose, California",United States,"Wilmington, Delaware",United States,"Delaware, United States",Native,"2014-05-01:131901700,131901703","Mining Hardware; Cloud Mining ""HashCloud"" (both until 2015 included); Pivot towards blockchain-based financial platform (2015). Although indicated maintaining their mining activities.",,TRUE,"Emerged in May 2014 from the merger of CloudHashing, which offers cloud mining contracts, and enterprise ASIC hardware designer HighBitcoin"
10434,Love Will Inc.,01/03/2014,Private,@pheevaWallet,https://pheeva.com/,21/01/2014,,28/05/2014,Dissolution,,"Lexington, Kentucky",United States,"Lexington, Kentucky",United States,"Kentucky, United States",Native,2014-03-01:121611601,Wallet,,TRUE,"""Love Will Inc"" also has other products, however these don't use the bitcoin blockchain. Love Will Inc website is no longer accessible."
10435,Poloniex,01/01/2014,Private,@Poloniex,https://www.poloniex.com/,09/02/2016,"2016-02-09:5959580;
2018-05-21:001328605",26/02/2018,Acquired by Circle but still operational,A,"2014-01-01:""Wilmington, Delaware"";
2018-05-21:""Boston, Massachussets"";",United States,"2014-01-01:""Wilmington, Delaware"";
2018-05-21:""Boston, Massachaussets"";
2019-07-22:""Hamilton""","2014-01-01:""United States"";
2019-07-22:""Bermuda""","Massachussets, United States",Native,"2014-01-01:101001000;
2015-01-01:101001000,173103000",Multi-Coin Only Exchange; Margin Trading (2015); Lending Platform (2015),,TRUE,"Hold MSB (FinCen) license registration number 31000091844018
Hold DABA Class F (Bermuda) license"
10436,Polycoin,01/01/2014,Private,@polycoin_tech,https://polycoin.io/about/,01/01/2014,"14,607,616.00",,,,"2014-01-01:""Tel Aviv"";
2018-11-15:""Tallinn""","2014-01-01:""Israel"";
2018-11-15:""Estonia""","2014-01-01:""Unidentified""
2018-11-15:""Tallinn""","2014-01-01:""Unidentified""
2018-11-15:""Estonia""",Estonia,Native,"2014-01-01:111301200;
2015-06-01:111301200","Payment Processor, then in mid-2015 focus on Blockchain Compliance (still offering merchant services), followed by a pivot towards ""Smart Contracts based on Blockchain technology"" in the beginning of 2016 (?); Back to trading in 2018",10,TRUE,
10437,PopChest,01/01/2015,Private,@_popnetwork,https://thepopnetwork.org/,01/04/2015,,,,,"Venice, California",United States,Grand Cayman,Cayman Islands,,,162822803,Media Distribution Platform powered by Bitcoin micropayments,,TRUE,"Still in private beta, but platform is working. Legal name: The Pop Network Foundation Ltd"
10438,Prasos,01/01/2012,Private,@prasosltd,https://prasos.fi/,01/01/2012,2469683-1,,,,Jyv?skyl?,Finland,Jyv?skyl?,Finland,Finland,Native,"2012-01-01:101011100,162812700;
2013-01-01:101011100,162812700,101011102,121611603;
2015-01-01:101011100,162812700,101011102,162822804,121611603;
2016-02-01:101011100,162812700,101011102,101001000,111301200,162822804,121611603;
2016-10-01:101011100,162812700,101011102,101001000,111301200,162822804;
2017-08-03:101011100,162812700,101011102,101001000,111301200,121601501,162822804","News portal, Brokerage Services (""Bittiraha.fi""); Reseller of Bitcoin Security Products/Preloaded Paper Wallet (rebranded as ""BTCStore.eu"" in 2013, discontinued in Oct 2016); BTM Operator (""Bittimaatti.fi"", 2013); Physical Bitcoin (""Denarium"", 2015), Merchant Services and Exchange (""Coinmotion"", Feb 2016), Vault (""Vault"",2017-08-03)",2017-01-01:15,TRUE,https://www.invesdor.com/en/pitches/875
10439,Predictious,01/07/2013,Private,@Predictious,https://www.predictious.com/,04/08/2010,"487,310.00",,,,Dublin,Ireland,Dublin,Ireland,Ireland,Native,162822805,Bitcoin Prediction Market,,TRUE,
10442,ProTip,20/07/2015,Private,@ProTipHQ,https://protip.is/,,,,,,,,,,,Native,111321401,Open-Source P2P Micropayment Chrome Browser Extension (plug-in) for automatically tipping content creators,,TRUE,
10443,Purse,09/10/2013,Private,@PurseIO,https://purse.io/,01/01/2014,"41,738.00",,,,"San Francisco, California",United States,"Wilmington, Delaware",United States,"Delaware, United States",Native,"2013-10-09:111301202,121601500",Marketplace for Amazon Gift Cards; Escrow Service,2018-01-01:19,TRUE,
10444,Quadriga CX,01/12/2013,Private,,www.quadrigacx.com,12/11/2014,74736Q,05/02/2019,"Very famous exit, Co-founder dead with private key, supposedly unfortunate coincidence",,"Vamcouver, British Columbia",Canada,"Vancouver, British Columbia",Canada,"British Columbia, Alberta",Native,"2013-12-01:101001000;
2014-01-30:101001000,101011102,111301200,111311302",Exchange; Marchant services and Remittances (2014); Bitcoin ATM Operator (2014-01-30),,TRUE,More information about its current status here: https://www.quadrigacxtrustee.com/
10445,Quickwallet,15/07/2014,Private,,,01/01/2014,,01/08/2014,"Acquired by ""Huobi""",A,,China,,China,,Native,121601500,Wallet,,TRUE,
10446,Qukuai.com,01/07/2014,Private,,,01/01/2014,,01/08/2014,"Acquired by ""Huobi""",A,,China,,China,,Native,152512303,Block Explorer,,TRUE,
10447,Quedex Limited,10/01/2018,Private,@quedexnet,https://quedex.net/,31/07/2019,"114,763.00",,,,Gibraltar,Gibraltar,Gibraltar,Gibraltar,Gibraltar,Native,"2018-01-10:101001000,121601501","Bitcoin Options and Futures Exchange (Trading Platform), Custodian Services",,TRUE,Regulated under Gribraltar's DLT Providers license (06/2019) Multi-sig cold wallet
10448,Quoine Pte Ltd,15/05/2014,Private,@QUOINE_Japan,https://www.liquid.com/,01/01/2014,,,,,"2014-05-15:""Singapore"";
2016-01-01:""Tokyo""","2014-05-15:""Singapore"";
2016-01-01:""Japan""",Singapore,Singapore,Singapore,Native,"2014-05-15:101001000;
2015-06-01:101001000,111301200;
2018-05-06:101001000,111301200,214604200;
2018-06-27:101001000,111301200,214604200,173103002","Exchange; Derivatives & Trading Platform (2014-05-15""Quoinex"",2017-08-01""Qryptos"", 2018-09-05""Liquid""); Payment Processor (2015-06-01), Margin lending (2018-06-27), IEO platform (2018-05-06)","2016-01-01:25;
2017-01-01:96;
2018-04-01:207",TRUE,"Quoine is a wholly owned subsidiary of QuoineCorporation, a Japanese corporation.To the extent related to card acquiring and payment processing services(being part of the Services) these services are provided by Quoine (Gibraltar) Limited (registered address: Suite 741C, Europort, GX11 1AA, Gibraltar; operational address: The Worklab, G04, WestOne, Europort Road, GX11 1AA, Gibraltar).
Partnership with LendingBlock:https://lendingblock.com/news/lendingblock/"
10449,KK Social Minds,20/01/2014,Private,@edmundedgar,https://www.socialminds.jp/,17/06/2009,,,,R,Tokyo,Japan,Tokyo,Japan,"Tokyo, Japan",Complete pivot,"2014-01-20:162822805;
2018-12-01:183423500","Oracle Service for smart contracts (""Realitio"",2018-12-01), Prediction market (""Reality Keys"", 2014-01-20-2018-12-01),",,TRUE,Social Minds founded this subsidiary for entering into Bitcoin ecosystem
10450,"2013-11-01:""Robocoin""
2015-04-21:""Romit""
",01/11/2013,Private,,,15/07/2014,"5,568,873.00",15/01/2016,"Pivot in 2015 towards remittances platform, then discontinuation of Bitcoin services",R,"Las Vegas, California",United States,"Wilmington, Delaware",United States,"Delaware, United States",Native,"2013-11-01:101011102;
2014-09-01:101011102,121601500;
2015-04-21:101011102,121601500,111311302;","Bitcoin ATM Manufacturer (until 2015 included); Remittances (""Romit"", 2015-04-21), Wallet (""Robocoin Wallet, 2014-09-01)",,TRUE,
10452,RTBTC,01/07/2013,Private,,,10/06/2013,"801,798,690.00",04/03/2014,"Acquired by ZeroBlock, owned by Blockchian.info",A,Texas,United States,Texas,United States,"Texas, United States",Native,"101001000,152512301","Trading Platform, Market visualisation",,TRUE,
10453,SABR.io,01/07/2015,,,,01/01/2015,,01/12/2016,Defunct,R,New York,United States,,Unidentified,,,152502200,Compliance/Analytics & Data Blockchain forensics,,TRUE,
10454,Safebit,01/09/2011,Private,@safebitio,https://safebit.io/,01/01/2011,"514,543,479.00",01/01/2013,Development discontinued (lack of developers),R,Tel Aviv,Israel,Tel Aviv,Israel,Israel,Native,121601500,Software Wallet,,TRUE,Seems to have resume operations in 2018: https://medium.com/safebit/introducing-safebit-a75f2a231008
10455,Safello,01/07/2013,Private,@SafelloAB,https://safello.com/,01/07/2013,556954-4165,,,,Stockholm,Sweden,Stockholm,Sweden,Sweden,Native,"2013-07-01:101011100;
2014-09-04:101011100,121611601;","Brokerage Services; Wallet (09.2014), Fundraising service for charities(?) (08.2014)",,TRUE,
10456,Satoshi Citadel Industries,01/05/2014,Private,@SCI_Ventures,https://www.sci.ph/,01/03/2014,,,,,Manila,Philippines,Manila,Philippines,Phillipines,Native,"2014-05-01:111301200,111311302,111301201,162802600;
2015-04-01:111301200,111311302,111301201,162802600,101011100;
2015-05-01:111301200,111311302,101011100;
2016-01-01:111301200,111311302,101011100,121601500;
2016-08-01:111301200,111311302,101011100,121601500,214304100,162812700;
2016-12-01:111311302,101011100,121601500","Payment Processor ""Bitmarket.ph""/""Coinage"" (until end 2018); Remittances ""Rebit.ph""; Buy bitcoin via Prepaid Card ""PrepaidBitcoin.ph"" (until end 2018); Bitcoin Social Media (""BitStars"", until 05.2015) Bill Payment Provider ""Bills.Ninja"" (until 05.2015); Brokerage Services ""BuyBitcoin.ph"" (04.2015); Mobile Wallet ""Bitbit.cash"" (2016), Investment service (""KEZA"", 08.2016), News (""Lifebit"",2016)",,TRUE,SCI Ventures Inc.'s wholly-owned subsidiary - Rebittance Inc.
10458,SatoshiLabs,12/12/2013,Private,@satoshilabs,https://satoshilabs.com/,12/12/2013,"2,440,032.00",,,,Prague,Czechia,Prague,Czechia,Czech Republic,Native,"2013-03-01:131901705,152512300;
2014-01-01:131901705,152512300,121611602","""Coinmap"" Directory Service (2013-03-01); Slush Pool (2010); Trezor Wallet (first shipped in 07.2014)",,TRUE,
10459,SatoshiPay,01/02/2016,Private,@SatoshiPay,https://satoshipay.io/,01/09/2014,"170,212.00",,,,Berlin,Germany,Berlin,Germany,Germany,Native,111321401,Nanopayments for Content Publishers,,TRUE,
10460,SatoshiTango,01/05/2014,Private,@SatoshiTango,https://www.satoshitango.com/en/,17/06/2015,012470V,,,,Buenos Aires,Argentina,Douglas,United Kingdom,Isle of Man,Native,"2014-05-01:101011100;
2015-03-01:101011100,111311302,111301204,111301201","Brokerage Services; Remittances (""Coinnect"", 2015-03-01 - in partnership with Volabit); Debit Card Provider (2015); Bill payment",,TRUE,Parent company: Finantech Limited
10461,Scorechain,01/01/2015,Private,@scorechain,https://www.scorechain.com/,07/08/2015,B199146,,,,Luxembourg,Luxembourg,Luxembourg,Luxembourg,,Native,"152502200,193703604","Blockchain Forensics, Compliance",,TRUE,
10464,SFOX,01/07/2014,Private,@SFox,https://www.sfox.com/,05/05/2015,"802,208,789.00",,,,"Los Angeles, California",United States,"Austin, Texas",United States,"California, United States",Native,"101011100,152512301,101001003","Brokerage, 3rd party Trading Platform,Market Data","2016-01-01:3;
2017-01-01:6;
2018-01-01:17",TRUE,Entire name: San Francisco Open Exchange (SFOX)
10465,ShapeShift.io,01/08/2014,Private,,https://shapeshift.io/#/coins,21/04/2017,CHE-367.039.468,,,,New York,United States,Zug,Switzerland,United Kingdom,Native,"2014-08-01:101001000;
2017-08-16:101001000,121601500","Instant Multi-Coin Only Exchange (without account/wallet), Hardware wallet (acquisition of KeepKey, 2017-08-16)","2016-01-01:22;
2017-01-01:86;
2018-01-01:97",TRUE,Legal name: ShapeShift Global Limited
10466,Sheep Marketplace,01/03/2013,,,,01/03/2013,,01/12/2013,"Shut down after vendor exploited a bug and stole $6MM in BTC -->however, some users believe it was a scam",R,N/A,N/A,N/A,N/A,N/A,Native,111301203,Online Black Market,,TRUE,
10467,"2014-05-01:""Shift Payments"";
2019-04-01:""Aptopayments""",01/01/2014,Private,@Apto_Payments,https://www.aptopayments.com/#/,09/05/2014,"5,530,853.00",,,,"San Francisco, California",United States,"Wilmington, Delaware",United States,N/A,Native,111301204,"Debit Card ""Shift Card"" (links Bitcoin; VISA; loyalty cards, etc together)",,TRUE,Apto Payments is developing the Coinbase Card app. Coinbase previously partnered with Shift Payments to issue a card in the U.S. (November 2015)
10468,Silk Road,01/02/2011,,,,01/01/2011,,01/10/2013,Shut down by the FBI,R,Unidentified,Unidentified,Unidentified,Unidentified,Unidentified,Native,111301203,Online Darknet Markeplace,,TRUE,
10469,Silk Road 2.0,01/11/2013,,,,01/11/2013,,01/11/2014,Shut down by the FBI,R,N/A,N/A,N/A,N/A,N/A,Native,111301203,Online Black Market,,TRUE,
10470,Simplex,01/01/2015,Private,@SimplexCC,https://www.simplex.com/,28/04/2014,"515,073,419.00",,,,N/A,Israel,Givatayim,Israel,Israel,Native,111301200,"Merchant Services, Credit Card Payments Platform (Processing + Fraud Detection) for Bitcoin Sellers and Buyers (Exchanges, Brokers, Businesses)",,TRUE,Legal name: SimplexCC Ltd.
10471,SkyCoinLab,01/04/2014,Private,@skycoinlab,,10/07/2014,,30/06/2016,Defunct,R,"Sudbury, Ontario",Canada,"Sudbury, Ontario",Canada,,Native,131901703,Multi-Coin Cloud Mining,,TRUE,Legal name: SKYCOINLAB CRYPTOCURRENCY SERVICES
10472,Skyhook,01/05/2014,Private,,,01/01/2013,854876-93,01/01/2015,Project not maintained/supported anymore,R,"Portland, Oregon",United States,"Portland, Oregon",United States,,Native,101011102,Open-Source Portable Bitcoin ATM Manufacturer,,TRUE,"Legal name: SKYHOOK, LLC"
10473,"2010-12-01:""Bitcoin.cz"";
2014-06-01:""Slush Pool""",01/12/2010,,@slushpool,https://slushpool.com/,01/01/2010,,,,,Prague,Czechia,Prague,Czechia,,Native,131901705,Mining Pool,,TRUE,Slushpool is not actually a legal entity but shifted hands from SatoshiLabs to Braiins
10474,Smartbit,05/07/2015,Private,@smartbithq,https://www.smartbit.com.au/,,,,,,Melbourne,Australia,N/A,N/A,Australia,Native,152512303,Block Explorer (including scripts and OP_Returns); Blockchain Data Provider (Stats and Charts),,TRUE,
10475,"2013-11-01:""Snapcard"";
2017-04-01:""Wyre""",19/11/2013,Private,@sendwyre,https://www.sendwyre.com/,19/11/2013,"5,435,000.00",,,,"San Francisco, California",United States,Delaware,United States,United States,Native,"2013-11-19:111301202;
2014-10-06:111301200;
2015-03-12:111301200,121601500;
2015-06-01:111301200,121601500,111311301;
2017-03-01:111301200,111311302;
2017-04-01:111311302;
2018-05-02:111311302,101011101","Bitcoin Shopping Cart/eCommerce (until 2014); Payment Processor (2014-10-06-2017-04-01); Remittances (""Mass Pay"", 2015-06-01); Wallet (2015-03-12-03.2017), OTC trading (""Wyre OTC desk"", 2018-05-02)",,TRUE,"Wyre Inc: Delaware, USA
Wyre Payments Inc.: subsidiary of Wyre Inc."
10476,SolidX,19/03/2014,Private,,https://sldx.com/,19/03/2014,"5,501,502.00",,,,"New York, New York",United States,Delaware,United States,United States,Native,"2014-03-19:214304100,101011100;
2016-07-07:214304100,101011100,183403301","Investment (Total Return Swaps); Brokerage Services; Consultancy; Development Platform (""Vida"",2016-07-07)",,TRUE,"Solidx Partners Inc.: Delaware, USA
SolidX Management LLC (for Bitcoin Trust): Delaware, USA, 5962269"
10477,SpectroCoin,01/10/2013,Private,@spectrocoin,https://spectrocoin.com/,01/02/2013,"303,008,845.00",,,,Vilnius,Lithuania,?iauliai,Lithuania,Lithuania,Native,"2013-10-01:101001000;
2014-01-01:101001000,111301200,121601500;
2015-01-01:101001000,111301200,121601500,111301204","Exchange; Wallet (2014); Payment Processor (2014); Debit Cards ""Spectrocard"" (2015)",36,TRUE,Legal name: UAB Spectro Finance
10478,Spendabit,01/01/2014,,@spendabit,https://spendabit.co/,01/01/2014,,,,,N/A,N/A,N/A,N/A,N/A,Native,152512302,Bitcoin Product Directory/Search Engine,,TRUE,
10479,Spondoolies Tech,01/01/2014,,@Spondoolies2,https://www.spondoolies-tech.com/,01/01/2013,,01/09/2015,"Merger with ""BTCS""",M,Nes-Tziona,Israel,N/A,N/A,Israel,Native,"131901700,131901703",Mining Hardware; Cloud,,TRUE,
10480,Stampery,01/01/2015,Private,@StamperyCo,https://stampery.com/,21/09/2015,"5,829,497.00",,,,"San Francisco, California",United States,"Dover, Delaware",United States,United States,Native,204003900,Notary Services can issue legally-binding proofs on the Bitcoin blockchain (users don't need to know they're using Bitcoin),,TRUE,
10481,Statoshi.info,07/06/2014,,,https://statoshi.info/,01/01/2014,,,,,N/A,N/A,N/A,N/A,N/A,Native,152512304,Free Open-Source Bitcoin Statistics Website (Data and Analytics),,TRUE,Operated by Jameson Lopp
10482,Streamium,21/05/2015,,@streamium_io,https://streamiumtheme.com/,01/01/2015,,,,,Buenos Aires,Argentina,,,,,162822803,Decentralized Video Streaming Platform offering micropayments to content providers through Payment Channels (Pay-as-you-go),,TRUE,
10483,"2015-04-01:""SurBTC""
2017-01-01:""Buda""",01/04/2015,Private,@BudaPuntoCom,https://www.buda.com/,01/01/2015,,,,,Santiago,Chile,Santiago,Chile,Chile,Native,101001000,Exchange,,TRUE,"Several entitites: SURBTC SpA (Chile), SURBTC SAS (Colombia), SURBTC S.A. (Per?)"
10484,Swarm,01/10/2014,Foundation,@swarmfund,https://www.swarm.fund/,01/01/2014,,,,,,United States,,United States,"California, United States",Native,"2014-01-01:214604200;
2015-06-01:183403300","Decentralized Crowdfunding Platform on Counterparty (issuing ""Swarmcoins""); in mid-2015 pivot towards Ethereum-based distributed governance platform (2015-04-01)",,TRUE,
10485,SwC Poker,01/02/2015,,@SwCPoker,https://swcpoker.eu/,01/02/2015,,,,,,Unidentified,,Unidentified,,Native,162822805,Bitcoin Poker Casino,,TRUE,
10486,SwissCEX,01/02/2014,,,,01/01/2014,,01/03/2015,"Shut down, refunded most customers",R,,Switzerland,,Switzerland,,Native,"101001000,101001000","Multi-Coin Exchange; Trading Platform, Market data",,TRUE,
10487,TabTrader,01/01/2014,Private,@tabtraderpro,https://tab-trader.com/,01/01/2013,"62,976,028.00",,,,Amsterdam,Netherlands,,Netherlands,England and Wales,Native,101001003,Mobile Trading Platform connecting to various exchanges,,TRUE,
10488,TagPesa,01/01/2014,,,,01/01/2014,,01/02/2015,"Acquired by ""igot""",A,Nairobi,Kenya,Nairobi,Kenya,,Native,"101001000,111311302","Exchange; Payment Processor, Remittances",,TRUE,
10489,Tangible Cryptography,01/01/2012,Private,,,30/12/2013,"5,457,897.00",01/12/2014,"Ceased all services in December/January 2015, not enough volume to make the Business model work",R,"Columbia, South Carolina",United States,"Wilmington, Delaware",United States,"South Carolina, United States",Native,101011100,"Brokerage Services (""Cellcoin"" and ""BitcoinsDirect"" in 2012; ""FastCash4Bitcoins"" until 2013; ""BitSimple"" in 2014)",,TRUE,Subsidiary: BitSimple LLC
10490,Tembusu,01/02/2014,Private,,www.tembusu.sg,01/01/2014,,28/05/2015,"Pivot towards ""TRUST Framework"" (not based on Bitcoin)",,Singapore,Singapore,Singapore,Singapore,Singapore,Native,101011102,"Bitcoin ATM Manufacturer and Operator; Pivot towards ""TRUST Framework"" (2015 )--> not related to Bitcoin anymore",,TRUE,Tembusu Terminals Pte Ltd. is a joint-venture between cryptocurrency consultancy firm Estates General and software/hardware development firm Red Steed Studios
10491,TeraExchange,01/09/2014,Private,@TeraExchange,https://www.teraexchange.com/,11/07/2013,"5,364,863.00",,,,"New York, New York",United States,"Wilmington, Delaware",United States,,Native,"101001000,101001000","Bitcoin Derivatives Trading Platform; Market Data (Bitcoin Price Index ""TeraBit"")",,TRUE,"Founded in 2011, but started offering bitcoin-related services in 2014"
10493,The LTB Network,01/04/2013,,@TheLTBNetwork,https://letstalkbitcoin.com/,01/01/2013,,,,,California,United States,N/A,N/A,,Native,162822800,Education; Media/Blogs,,TRUE,
10494,The Rock Trading,07/06/2011,Private,@TheRockTrading,https://www.therocktrading.com/,07/06/2011,"2013-07-01:C61326
2018-02-01:2507359",,,,Milan,Italy,"2011-06-01:""Italy""
2013-07-01:""La Valette"";
2018-02-01:""Milan""","2011-06-01:""Italy""
2013-07-01:""Malta"";
2018-02-01:""Italy""",EU,Complete pivot,"2011-06-07:101001000;
2018-09-04:101001000,101011101","Exchange; Ripple Payment Gateway (2013), also multi-coin, OTC (2018-09-04)",,TRUE,"Founded in 2007, but started offering bitcoin trading in 2011"
10495,Third Key Solutions,31/03/2015,Private,@3rdKeySolutions,https://thirdkey.solutions/,31/03/2015,,,,,"Chicago, Illinois",United States,N/A,N/A,,Native,"121611600,193713700",Consulting and Key Management Services,,TRUE,
10496,Tierion,01/09/2015,Private,@Tierion,https://tierion.com/,24/11/2015,"5,844,243.00",,,,"Mountain View, California",United States,"Wilmington, Delaware",United States,"Connecticut, United States",Native,204003901,"Cloud Storage System offering Blockchain Receipts Collect and record data in the Bitcoin blockchain using the open standard ""Chainpoint"" (= Federated server for building blockchain notarized Merkle trees)",,TRUE,
10498,"2013-01-01:""The Genesis Block"";
2014-03-23:""TradeBlock""",01/01/2013,Private,@TradeBlock,https://tradeblock.com/,16/12/2016,"6,225,173.00",,,,"New York, New York",United States,"Wilmington, Delaware",United States,"New York, United States",Native,"152512301,152532500","Market Data/Analytics/Research Provider for mainly institutional Clients, Research publication",,TRUE,
10499,TradeHill,01/06/2011,,,,01/01/2011,,01/01/2013,"First shut down in 2012, then reopened beginning of 2013, but forced to shut down again due to regulatory reasons regarding their bank relationship",R,"San Francisco, California",United States,"Wilmington, Delaware",United States,"Delaware, United States",Native,101001000,Exchange,,TRUE,
10500,Tradewave,01/01/2014,Private,@tradewavenet,,02/07/2015,"5,562,461.00",01/09/2015,Defunct,,London,United Kingdom,"Wilmington, Delaware",United States,"New York, United States",Native,101001003,Platform for building automated trading strategy for cryptocurrencies,,TRUE,
10501,Unisend,01/01/2014,Private,,,01/01/2014,,26/09/2015,"Acquired by ""BitPagos""",A,Buenos Aires,Argentina,Buenos Aires,Argentina,,Native,101001000,Exchange,,TRUE,
10502,"2013-12-01:""CoinMonk"";
2016-04-06:""Unocoin""",01/12/2013,Private,@unocoin,https://www.unocoin.com/in,17/12/2013,"2013-12-17:""072554"";
2016-04-06:""201538056R""",,,,Bangalore,India,"2013-12-17:""Tumkur, Karnataka"";
2016-04-06:""Singapore""","2013-12-17:""India"";
2016-04-06:""Singapore""",India,Native,"2013-12-01:101011100,121601500;
2014-01-01:101011100,121601500,111301200;
2016-05-01:101011100,121601500,111301200,111301201;
2016-08-30:101011100,121601500,111301200,111301201,101011101;
2018-06-01:101011100,121601500,111301200,111301201,101011101,101001000","Brokerage Services; Wallet/Money Transfer Platform; Payment Processor (2014), Bill Payment (2016-05-01) OTC (2016-08-30), Order-book exchange (2018-06-01)",,TRUE,"Subsidiary: Unocoin Technologies PVT Ltd (Karnataka, India)
Parent company: UNOCOIN TECHNOLOGIES PTE. LTD."
10503,Uproov,01/12/2015,Private,@uproov,https://uproov.com/,09/07/2015,606 998 458,,,,"San Diego, California",United States,Perth,Australia,Australia,Native,204003901,Mobile Timestamping Service (Live Proof-of-Existence App on Bitcoin Blockchain),,TRUE,Parent company: Ledger Assets Pty Ltd
10504,Usebitcoins.info,01/06/2013,,@UseBitcoins,https://usebitcoins.info/,01/01/2013,,,,,Unidentified,Greece,Unidentified,Unidentified,Unidentified,Native,152512300,Directory for Bitcoin-related Services,,TRUE,
10505,Vault of Satoshi,01/10/2013,Private,,,18/04/2013,"2,369,690.00",05/02/2015,"Founders wanted to pursue other venture (""TurboFlix"")",R,Toronto,Canada,"Brantford, Ontario",Canada,Canada,Native,101001000,Exchange,,TRUE,
10506,Vaultoro,01/02/2015,Private,,https://www.vaultoro.com/,30/12/2014,"9,369,786.00",,,,Cardiff,United Kingdom,Cardiff,United Kingdom,United Kingdom,Native,101001000,"Bitcoin-Gold Exchange. Buy solid gold with bitcoin, sell solid gold for Bitcoin.",,TRUE,"Slated to launch Valutoro 2.0 (platform with DASH support and trading of other metals) in Q2, 2019."
10515,Xapo,01/03/2014,Private,@xapo,https://www.xapo.com/,01/01/2014,,,,,"2014-03-01:""Palo Alto, California"";
2015-05-14:""Zug""","2014-03-01:""United States"";
2015-05-14:""Switzerland""",George Town,Cayman Islands,Hong Kong,Native,"2014-03-01:121601501,111301204;
2014-08-26:121601501,111301204,101011100;
2018-01-04:121601501,101011100","Cold Storage Vault Provider with funds insured; Debit Card (until 2018-01-04), Wire Transfers to purchase bitcoins (Brokerage) (2014-08-26)",350,TRUE,"Registered as money service business (MSB) with FSB
Institutional Custody Business to Coinbase (2019-08-16)
Xapo E-money services: Xapo (Gibraltar) Limited 111928
Xapo Inc.: Delaware, USA
Xapo Limited: Hong Kong
Xapo Insurance Limited: Bermuda
Xapo Holdings Ltd: Cayman Islands
https://www.sec.gov/Archives/edgar/data/1615718/000161571815000002/xslFormDX01/primary_doc.xml"
10588,Messari,26/10/2017,Private,@MessariCrypto,www.messari.io,03/01/2018,"6,692,807.00",,,,New York City,United States,"Wilmington, Delaware",United States,"Delaware, United States",Native,152512300,Directory (equivalent of EDGAR database for cryptoassets),,TRUE,
10599,Braiins Systems,17/02/2016,Private,@braiins_systems,https://braiins.com/,01/09/2011,"24,147,931.00",,,,Prague,Czechia,Prague,Czechia,Czechia,Native,"2016-02-17:131901705;
2018-09-01:131901705,131901707","Pool operation (""Slushpool"",2016-02-17), Open-source OS for cryptocurrency embedded device (""Braiins OS"",2018-09-01)",,TRUE,
10601,Rakuten,19/08/2019,Public,@Rakuten_Wallet,https://www.rakuten-wallet.co.jp/,07/02/1997,,,,,Tokyo,Japan,Tokyo,Japan,Japan,Partial pivot,101001000,"Exchange (""Rakuten Wallet"", 2019-08-19)",,TRUE,"Rakuten Wallet, Inc., a consolidated subsidiary of Rakuten Group. separates money deposited by customers (customer assets) from the company's own funds, managing the assets (trust maintenance) in trust accounts provided by Rakuten Trust Co., Ltd., the trust company of Rakuten Group. Rakuten Trust manages those trust assets through Rakuten Bank, Ltd. savings accounts."
10020,ANX,01/07/2013,Private,@anx_intl,https://www.anxintl.com,01/06/2013,2364920,,,,Hong Kong,Hong Kong,Hong Kong,Hong Kong,Hong Kong,Native,"2013-07-01:101001000;
2014-01-01:101001000,121601500,102011200,111301204,101011100;
2018-05-01:101001000,121601500,102011200,111301204,101011100,193713702","Exchange; Multi-Coin Trading Platform ""ANXPRO"" (2014); Mobile Wallet (2014); ATM Operator (2014); Debit Card (2014); Brokerage Service with physical store (2014), Education (2018)",,TRUE,
10021,Anycoin Direct,01/04/2013,Private,@anycoindirect,https://anycoindirect.eu/en,01/01/2013,59466197,,,,Veghel,Netherlands,Veghel,Netherlands,Netherlands,Native,"101011100
",Multi-Coin Brokerage Service,37,TRUE,
10030,BetMoose,01/06/2014,Private,@BetMoose,https://www.betmoose.com/,,,,,,Unidentified,Canada,Unidentified,Canada,Canada,Native,162822805,"P2P Prediction Market and Betting Exchange, odds and markets can be set by users.",,TRUE,
10031,Bets of Bitcoin,01/08/2011,Private,,,,,01/12/2013,Exit scam,R,Unidentified,Unidentified,Unidentified,Unidentified,Unidentified,Native,162822805,Bitcoin Prediction Market/Betting Site,,TRUE,
10039,Bitbank,01/09/2014,Private,@BitBankCom,https://www.bitbank.com/,01/05/2014,,,,,Shenzhen,China,Shenzhen,China,China,Native,"2014-09-01:101021201,121611601,173113100;
2015-01-01:101001000,162812700,101021201,121611601,173113100;
2019-01-01:2143044100,101001000,162812700,101021201,121611601,173113100;","Bitcoin ATM Operator; Wallet; Payment Processor; News (2015); Trading Platform (2015), Asset Manager (2019)",,TRUE,
10044,BitBork,01/12/2015,Private,,,01/01/2015,,01/12/2017,No information,R,"Bampton, Ontario",Canada,"Branpton, Ontario",Canada,Canada,Native,102011200,Bitcoin ATM Operator,,TRUE,
10045,BitBox,01/05/2013,Private,,https://www.bitbox.in,,,01/01/2014,No information,R,Pune,India,Pune,India,India,Native,"101011100,111301200",Exchange; Payment Processor,,TRUE,
10046,Bitchain,01/01/2015,Private,,,,,01/01/2016,No information,R,Barcelona,Spain,Barcelona,Spain,Spain,Native,102011200,Bitcoin ATM Operator,,TRUE,
10049,Bitcoin Brains,01/09/2013,Private,@bitcoinbrains,https://bitcoinbrains.com/,01/01/2013,,01/05/2015,"Acquired by ""BitNational"", listed below too",A,"Calgary, Alberta",Canada,"Calgary, Alberta",Canada,Canada,Native,"101011101,131901706",OTC Bitcoin Brokerage; Vendor of mining hardware,,,
10058,Bitcoin Solutions,01/02/2014,Private,@btcsolutionsca,https://www.bitcoinsolutions.ca/,01/11/2013,2017913456,,,,"Edmonton, Alberta",Canada,"Edmonton, Alberta",Canada,Canada,Native,"2014-02-01:101011100,101011101,102011200;
2019-01-01:101011100,101011101,102011200,111301200,111301201","Bitcoin & Litecoin Exchange, Stablecoin Issuer, OTC (2019-02-01), Merchant services (2018-12-01) , Crowdfunding STO (2018-08-02)",,TRUE,
10066,BitcoinsBerlin,01/01/2013,Private,@bitcoinsberlin,https://web.archive.org/web/20160401000555/http://bitcoinsberlin.com/,01/01/2013,HRB 149600 B,01/01/2017,"
",R,Berlin,Germany,Berlin,Germany,Germany,Native,193713700,Bitcoin Startup Incubator,,TRUE,"Actually an incubator, but started all projects on its own so far --> ""Bitwala"" included as seperate entity, although owned by BitcoinsBerlin"
10067,BitcoinSpinner,01/11/2011,Private,@btcspinner,https://btcspinner.io/,01/01/2011,,,"Developer Jan Moller started working on the ""Mycelium"" wallet",,Unidentified,Unidentified,Unidentified,Unidentified,Unidentified,Native,162822802,"Wallet, Spin and get paid bitcoin (Gaming)",,TRUE,
10068,BitcoinToYou,01/05/2013,Private,@bitcointoyou,https://www.bitcointoyou.com/,01/01/2013,,,,,"Betim, Minas Gerais",Brazil,"Betim, Minas Gerais",Brazil,Brazil,Native,"2013-05-01:101001000,121601500;
2014-01-01:101001000,121601500,101011100;
2019-06-01:101001000,121601500,101011100,101011101","2013-01-01:Multi-Coin Exchange; 
2014-01-01:Hosted Wallet/Money Transfer Platform,Brokerage Services
2019-06-01: OTC",,TRUE,"Formally incorporated in 2010, but in stealth mode until 2013"
10075,"2014-12-01:""BitFinance"";
2017-10-01:""Golix""",01/12/2014,Private,@golixdotcom,https://www.golix.com/,01/01/2014,,,,,Harare,Zimbabwe,Harare,Zimbabwe,Unidentified,Native,"101011100,101021200","Brokerage Service ""Bitcoinfundi""; ""CryptoCounter"" Bitcoin ATM Manufacturer",,TRUE,"CryptoCounters first shipped in 2015. Golix exchange in South Africa, Uganda, Tanzania, Kenya, Nigeria, Rwanda and Cameroon"
10076,Bitfinex,01/01/2012,Private,@bitfinex,https://www.bitfinex.com/,01/12/2012,1 774 852,,,,Taipei,Taiwan,Road Town,British Virgin Islands,British Virgin Islands,Native,"2012-01-01:101001000;
2016-12-01:101001000,101011101","Exchange; Trading Platform (2012), Margin Trading (2012), Margin Funding, OTC (2016), Advance trading","2017-01-01:85;
2018-01-01:90",TRUE,"Parent company: iFinex Inc. Other associated with it: Ethfinex, iFinex Inc., BFXNA Inc., BFXWW Inc., DigFinex Inc."
10077,Bitfloor,01/11/2011,Private,,,01/01/2011,,01/04/2013,"US Bank account closure forced them to shut down, Hacked and lost 24,000 BTC",R,"New York, New York",United States,"New York, New York",United States,United States,Native,101001000,Exchange; Trading Platform,,TRUE,
10078,bitFlyer,09/01/2014,Private,@bitFlyer,https://bitflyer.com/en-jp/,01/01/2014,,,,,Tokyo,Japan,Tokyo,Japan,Japan,Native,"2014-01-09:101001000,101011100;
2015-01-01:101001000,101011100,152512303;
2018-01-01:101001000,101011100,152512303,152532500","Exchange; Trading Platform; Crowdfunding Platform ""fundFlyer""; Block Explorer ""chainFlyer"" (2015) a reputable (and the largest) Japanese bitcoin broker and exchange, Research (""Blockchain Lab"", 2018)",,TRUE,"Parent Company: bitFlyer Holdings, Inc. (established in 2018-10-01)"
10079,BitFunder,01/01/2012,Private,,,,,14/11/2013,No information,R,Texas,United States,Unidentified,Unidentified,United States,Native,101001000,Bitcoin Stock Exchange (equities),,TRUE,"Unincorporated, operated from the owner's place https://www.sec.gov/litigation/complaints/2018/comp24078.pdf"
10080,BitFury,01/01/2011,Private,@bitfurygroup,https://bitfury.com,01/01/2011,60269421,,,,Amsterdam,Netherlands,Amsterdam,Netherlands,Netherlands,Native,"2011-01-01:131901702;
2013-01-01:131901702,131901700,131901703;
2019-03-31:131901702,131901700,131901703,193703603
","Mining; Mining Hardware (2013); Cloud Mining (2013); Partial Pivot towards ""Blockchain Services"", KYC/AML and compliance services (2019:Crystal Chain)",,TRUE,"Parent compay: Bitfury Holding B.V
Subsidiary: BitFury Group Limited (?), BitFury (Malta) Limited"
10081,BitGo,01/01/2013,Private,@bitgo,https://www.bitgo.com/,01/01/2013,4976420,,,,"Palo Alto, California",United States,"Wilmington, Delaware",United States,United States,Native,"2013-01-01:121611601;
2014-01-01:121611601,183413400;
2018-01-01:121611601,183413400,121601501;
2019-10-03:121611601,183413400,121601501,131911801","Wallet; General API Provider/Security Platform (2014); Proof-of-Reserve Service ""Verified by BitGo"" (2015); Insured Accounts (2015); 0-Confirmation Service ""BitGo Instant"" (2016), Vault services (2018), Staking (Bitgo Staking, 2019-10-03)",,TRUE,
10082,BitGold,01/01/2014,Public,@goldmoney,https://www.goldmoney.com/,01/02/2014,838387181,22/05/2015,Pivot towards blockchain-based solutions. Acquired Goldmoney and then took on the name.,P,"Toronto, Ontario",Canada,"Toronto, Ontario",Canada,Canada,Complete pivot,"101001000
",Bitcoin-Gold Exchange (until end of 2014); then pivot towards blockchain-based payment and savings system with gold. Pivoted out of blockchain entirely in March 2019.,,,
10083,BitHalo,01/01/2014,Private,@BitHaloOfficial,https://bithalo.org/,,,,,,Unidentified,Unidentified,Unidentified,Unidentified,Unidentified,Native,183403301,"Open-Source Decentralized Smart Contracting Software (Client) for Bitcoin and Blackcoin (""BlackHalo"")",5,TRUE,Can be used for decentralised escrow among others
10084,"2014-05-01:""Bither"";
2017-10-01:""BitPie""",01/05/2014,Private,@BitpieWallet,https://bitpie.com/,01/01/2015,,,,,Sydney,Australia,,Seychelles,Seychelles,Native,"2014-05-01:121601500;
2017-10-01:121601500,101001000","Smartphone and PC based Bitcoin wallet, other wallet (BitPie), Order-book (BitPie)",,TRUE,"https://buildmedia.readthedocs.org/media/pdf/bitpie-docs-en/latest/bitpie-docs-en.pdf
BitPie Limited
Also has an office in Hong Kong"
10085,Bitify,01/09/2013,Private,@bitify_com,https://bitify.com/,01/01/2013,,,,,"Newport Beach, New South Wales",Australia,"Newport Beach, New South Wales",Australia,Australia,Native,111301203,Bitcoin/Litecoin-powered Marketplace and Auction Site with escrow service,,TRUE,Cryptothrift got hacked and lost bitcoins which resulted in a loss of trust in the brand name.
10086,BitInstant,01/01/2011,Private,@bitinstantnews,,01/12/2011,4171651,01/01/2014,Founder arrested for violating AML regulations,R,"New York,New York",United States,"New York, New York",United States,United States,Native,"2011-01-01:101011100;
2012-01-01:101011100,111301204",Brokerage Services; Prepaid Debit Card (2012),,TRUE,
10087,BitKonan,01/07/2013,Private,@BitKonan,bitkonan.com,22/05/2013,60297216,,,,Zagreb,Croatia,Split,Croatia,Croatia,Native,101011100,Exchange,,TRUE,"Legal name: Digital Assets doo
"
10088,BitLaundry,01/09/2010,Private,,http://bitlaundry.com/,01/01/2010,,01/04/2016,Defunct,R,Unidentified,Unidentified,Unidentified,Unidentified,Unidentified,Native,204024100,Mixing Service,,TRUE,Sold in May 2011 to Mike Goguiski
10089,Bitmain,01/01/2013,Private,@BITMAINtech,https://www.bitmain.com/,28/10/2013,,,,,Beijing,China,Grand Cayman,Cayman Islands,Hong Kong,Native,"2013-01-01:131901700,131901704,131901702;
2014-01-01:131901700,131901704,131901702,131901705,131901703
","Mining Hardware Manufacturer ""Antminer""; Cloud Mining (""Hashnest"", 2014); Mining Pool (""Antpool"",2014), Proprietary mining","2016-01-01:500;
2017-01-01:1100;
2018-01-01:1800",TRUE,"Legal name: Beijing BitMain Technologies Holding Company (Cayman Islands. 2013)
Subsidiaries: Beijing BitMain Technologies Holding Company (PRC. 2013), Bitmain Technologies Limited (Hong Kong, 2014-01-10), Bitmain Inc. (Delaware, US, 2015-01-07)
http://enterprise.press/wp-content/uploads/2018/09/BitmainProspectus.pdf"
10090,BitMarket.eu,01/04/2011,Private,bitmarketeu,bitmarket.eu,01/01/2011,,01/12/2012,Shut down after loss of customer funds because of speculation. Current https://bitmarket.eu/ is a new site.,R,Unidentified,Poland,Unidentified,Poland,Poland,Native,101001000,Exchange,,TRUE,
10091,BitMarket.pl,01/03/2014,Private,,https://bitmarket.pl/,01/01/2014,,08/07/2019,"ceased operations due to ""loss of liquidity""",R,Unidentified,Poland,Unidentified,Poland,Poland,Native,101011100,Bitcoin & Litecoin Exchange; Trading Platform,,TRUE,"Dear Users, We regret to inform you that due to the loss of liquidity, since 08/07/2019, Bitmarket.pl/net was forced to cease its operations. We will inform you about further steps."
10092,Bitmarkets,01/11/2014,Private,,https://voluntarylabs.org/bitmarkets/,01/01/2014,,,,,Unidentified,Unidentified,Unidentified,Unidentified,Unidentified,Native,101021201,Free Open-Source Decentralized P2P Marketplace with 2-party-escrow (instead of 3),2014-11-01:4,TRUE,Officially Voluntary Labs
10093,BitMEX,01/11/2014,Private,@bitmexdotcom,bitmex.com,01/01/2014,148707,,,,Hong Kong,Hong Kong,"Mahe, Beau Vallon",Seychelles,Seychelles,Native,"2014-11-01:101001000;
201-01-01:101001000,152532500","Derivatives Trading Platform, famous in the crypto community,offering the highest leverage (up to 100x) on trades on a liquid exchange, Research Arm (""BitMEX Research"", 2017)",,TRUE,Legal Name: HDR Global Trading Limited
10094,BitMinter,01/06/2011,Private,@bitminter,https://bitminter.com/,01/01/2011,914390729,,,,Olso,Norway,Oslo,Norway,Norway,Native,131901705,Mining Pool,,TRUE,operated by the Norwegian company Aesir Financial AS (914390729)
10095,Bitmixer.io,01/01/2014,Private,,http://web.archive.org/web/20160124224144/https://bitmixer.io/index.html,01/01/2014,,24/07/2017,Ceased operations due to realising that Bitcoin is not anonymous,R,Unidentified,Unidentified,Unidentified,Unidentified,Unidentified,Native,204024100,Bitcoin Tumbler/Mixing Service,,,"""Hi all! You may use Dash or Zerocoin if you want to buy some weed. Not Bitcoin."""
10096,BitNational,01/02/2014,Private,@bitnational,https://bitnational.com/,01/01/2013,2017875408,,,,"Calgary, Alberta",Canada,"Calgary, Alberta",Canada,Canada,Native,"2014-02-01:101021200;
2015-01-01:101021200,101011100;
2016-01-01:101021200,101011100,101011101;
2019-03-01:101021200,101011100,101011101,101001000;","Bitcoin ATM Operator; Brokerage Services (2015), OTC (2016), Exchange (2019-03-01)",,TRUE,
10097,Bitnet,01/05/2014,Private,@BitnetTech,http://web.archive.org/web/20150510195713/http://bitnet.io/,16/01/2014,537994,20/10/2016,Aqcuired by uphold,A,Belfast,Ireland,Dublin,Ireland,Unidentified,Native,"2014-01-01:111301200;
2016-01-01:111301200,111311302,193713700,214604200","Payment Processor (2014), Blockchain Consulting (2016), Digital Asset Management [Issuance] (2016), Remittance (2016)",,TRUE,https://uphold.com/en/press-media/posts/press-releases/uphold-acquires-bitnet-announces-uphold-merchant-services-ums
10098,BitNexo,01/08/2015,Private,@bitnexo,http://web.archive.org/web/20161129023639/https://www.bitnexo.com/,10/03/2015,76417172-1,01/07/2017,Defunct,R,Santiago,Chile,Santiago,Chile,Chile,Native,"111311301,111311302",Remittances and B2B Cross-border Payments,,,Legal Entity: Bitnex SPA
10099,Bitnik,01/01/2014,Private,@Bitnik_eu,https://bitnik.eu/en/,16/04/2014,6595162000,,,,Ljubljana,Slovenia,Ljubljana,Slovenia,Slovenia,Native,101021200,"Bitcoin ATM Operator; ""Reload"": Rebuy bitcoins automatically once spent (2015)",4,TRUE,"""Reload"": works by linking your wallet(s) and your exchange account(s) together"
10100,BitOasis,01/01/2015,Private,@bitoasis,https://bitoasis.net/en/,01/02/2014,"1897731
",,,,Dubai,United Arab Emirates,Tortola,British Virgin Islands,British Virgin Islands,Native,"2015-01-01:101011100,121601500;
2019-07-01:101011100,121601500,101001000","Brokerage Services (""BitOasis Core""); Order-book (""BitOasis Pro"",2019-07-01); Multi-Sig Wallet",,TRUE,"Legal Name: BO Technologies Limited a limited liability company incorporated in Malta with company number C 89099
Offer different services through different legal entities, including one in Malta"
10101,BitOcean,01/09/2014,Private,@BitOcean_JP,http://www.bitocean.co/,01/01/2013,,,,,Tokyo,Japan,Tokyo,Japan,Japan,Native,101021200,Bitcoin ATM Manufacturer,,TRUE,
10102,BitoEX,01/10/2014,Private,@BitoEX,https://www.bitoex.com/,07/03/2017,56346103,,,,Taipei,Taiwan,British Virgin Islands,British Virgin Islands,China,Native,"2014-10-01:101011100,121601500;
2015-01-01:101011100,121601500,111311302,111301200;
2019-03-01:101011100,121601500,111311302,111301200,101001000","Brokerage Services; Wallet/Money Transfer Platform; Payment Processor (2015), Order-book (""BitoPro"", 2019-03-01)",,TRUE,Legal Name: BitoEX Technology LIMITED
10103,Bitok,01/09/2014,Private,@Bitok_com,http://web.archive.org/web/20150315011831/https://bitok.com/,26/11/2013,8790157,01/05/2016,Not met projected goals,R,London,United Kingdom,London,United Kingdom,United Kingdom,Native,101011100,Brokerage Services; Multi-Coin Exchange,,TRUE,"Legal Name: Bitok LTD
Previously known as BITCOIN INNOVATIONS LTD."
10104,Bitomat,01/04/2011,Private,,http://web.archive.org/web/20110406180353/http://bitomat.pl/,01/01/2011,,01/08/2011,"Acquired by Mt. Gox, after losing 17'000 BTC",R,Unidentified,Poland,Unidentified,Poland,Poland,Native,101011100,Brokerage Services,,TRUE,
10105,"2012-03-12:""iDealCoin"";
2012-04-12:""Bitonic""",12/03/2012,Private,@bitonic,https://bitonic.nl/en/,01/05/2012,58276149,,,,Amsterdam,Netherlands,Amsterdam,Netherlands,Netherlands,Native,"2012-03-12:101011100;
2013-01-01:101011100,111301200;
2016-01-01:101011100,111301200,193713702;
2016-04-01:101011100,111301200,193713702,101001000","Brokerage Services; Merchant Sevrices (""BitMerchant"",2013); Order-book (""BL3P"",2016-04-01), Education (""Bitonic Academy"",2016), News (""bitcoin.nl"",),C",,TRUE,
10106,"2013-09-01:""BitPagos"";
2017-04-01:""Ripio""",01/09/2013,Private,@ripioapp,https://ripio.com/en/,29/04/2013,5326206,,,,"San Francisco, California",United States,"Wimington, Delaware",United States,Unidentified,Native,"2013-09-01:111301200;
2014-01-01:111301200,101011100;
2015-01-01:111301200,101011100,101001000;
2016-01-01:111301200,101011100,101001000,173103000;
2019-05-01:111301200,101011100,101001000,173103000,101011101","Payment Processor; Brokerage Services (""Ripio"", 2014); Exchange (acquisition of 2015, then launch of another order-book in ay 2019); Lending (""Ripio Credit Network"", 2016); OTC (""RipioOTC"", 2019-05-01)",,TRUE,"I am unsure of the following info:
--> Parent: Ripio Holding Ltd.
-->Legal Name Subsidaries: 
Moonbird SRL(30-71453554-0), Buenos Aires, Argentina
CuentaDigital SRL (Not 100% sure?)"
10107,BitPay,01/05/2011,Private,@bitpay,https://bitpay.com/,01/01/2011,5163966,,,,"2011-05-01:""Orlando, Florida"";
2013-01-01:""Atlanta, Georgia""",United States,"Wimington, Delaware",United States,United States,Native,"2011-05-01:111301200;
2014-01-01:111301200,111311300,183403301;
2015-06-01:111301200,111311300,183403301,121611601;
2015-06-01:111301200,111311300,183403301,121611601,111301204","Payment Processor; General API and OSS Provider (2013?); Free and Open-Source Wallet (""Copay"", 2015-06); Free and Open-Source Bitcoin Development Platform (""Bitcore"", 2014); Payroll Services (2014-01), Debit Card (""BItPay Visa"", 2016-05)",,TRUE,
10108,BitPesa,01/10/2013,Private,@BitPesa,https://www.bitpesa.co,20/01/2017,B 211.963,,,,"2013-10-01:""Nairobi"";
2015-05-01:""Tanzania"";
2016-01-01:""Nigeria""
","2013-10-01:""Kenya"";
2015-05-01:""Tanzania"";
2016-01-01:""Nigeria"";
2017-01-20:""Kenya""",Luxembourg,Luxembourg,Luxembourg,Native,"111311302,101011100,101011101,111311301,111311301",Money Transfer Platform/Remittances (personal and B2B); Brokerage Services; OTC Trade; M2M Payments,"2016-01-01:12;
2017-01-01:20;
2018-01-01:60;
2019-08-01:89",TRUE,"In February 2018, BitPesa acquired TransferZero, an online money transfer company in Spain. BitPesa opeartes under BTC Africa S.A. https://opencorporates.com/companies/lu/B211963"
10109,BitPremier,01/05/2013,Private,@BitPremier,http://web.archive.org/web/20130503225408/http://www.bitpremier.com/,26/05/2013,5304419,22/09/2017,"""After four years serving the Bitcoin community, we have made the decision to move on to other ventures""",R,"Gaithersburg, Maryland",United States,Delaware,United States,United States,Native,111301202,Luxury Items for Bitcoin Shop,,TRUE,"BitPremier is now a blog - unrelated

https://www.google.com/url?q=https://www.crunchbase.com/organization/bitpremier%23section-overview&sa=D&ust=1565694267931000&usg=AFQjCNEpSrHETwJAOnCFjy0PdUnjSiJc-Q"
10110,Bitproof,01/01/2015,Private,,https://www.bitproof.net/page,28/01/2015,5682506,,,,"Walut Creek, California",United States,Delaware,United States,United States,Native,204003900,Proof-of-Existence: Notary Services,,TRUE,
10111,"2013-07-01:""BuyBitcoin.US""
2013-10-08:""BitQuick""",01/07/2013,Private,@bitquickco,https://www.bitquick.co/,03/06/2013,5682506,01/06/2016,Aquired by Athena Bitcoin,A,Chicago,United States,Delaware,United States,United States,Native,101021201,P2P Marketplace for Buying And Selling bitcoins,2013-01-01:1,TRUE,"""BitQuick has a flexible platform that has already expanded operations to Europe, Taiwan and India and launched AltQuick, an alternate cryptocurrency exchange."""
10112,Bitrated,01/01/2014,Private,@bitrated,https://www.bitrated.com,01/12/2013,515093250,,,,Tel Aviv,Israel,Tel Aviv,Israel,Israel,Native,"101011100,152522400,193723800","Arbitration Marketplace (Escrow, 2014); Trust Platform (2015)",2019-11-18:3,TRUE,Consumer Protection; Reputation management system; escrow payment system and arbitration marketplace
10113,Bitrefill,01/11/2014,Private,@bitrefill,https://www.bitrefill.com,29/01/2015,559001-6035,,,,Stockholm,Sweden,Stockholm,Sweden,Sweden,Native,111301202,Mobile Credit & other stuff buying with bitcoins,2018-12-01:4,TRUE,
10115,Bits of Gold,01/01/2013,Private,@BitsofGold_LTD,https://www.bitsofgold.co.il,15/01/2013,514866607,,,,Tel Aviv,Israel,Tel Aviv,Israel,Israel,Native,"2013-01-01:101011100;
2014-01-01:101011100,101021200;
2015-01-01:101011100,101021200,111301200;
2018-01-01:101011100,101021200,111301200,101011101","Brokerage Service; BTM Operator (2014); Payment Processor (2015), OTC (2018)","2016-01-01:3;
2017-01-01:6;
2018-01-01:20",TRUE,
10116,Bits of Proof,01/01/2013,Private,,http://web.archive.org/web/20130425173340/https://bitsofproof.com/,25/03/2013,13647614166,25/06/2015,2015-06-25 Acquired by Digital Assets Holdings LLC,A,"2013-03-25:""Budapest"";
2015-06-25:""New York""","2013-01-01:""Hungary"";
2015-06-25:""United States""","2013-03-25:""Budapest"";
2015-06-25:""Delaware""","2013-01-01:""Hungary"";
2015-06-25:""United States""","2013-01-01:""Hungary"";
2015-06-25:""United States""",Native,"183403302,111301200","BOP Bitcoin Enterprise Server (modular implementation of Bitcoin protocol, client library), other software solutions that enable almost trust-less services (BopShop for Merchants)",,TRUE,"Bit of Proof was aquried by CoinTerra in 2014. The legal enitiy did not seem to change as well as the service offering on the webpage.See: http://web.archive.org/web/20140821200504/https://bitsofproof.com/?page_id=56
Later acquired by Digital Asset Holdings: http://web.archive.org/web/20160328085425/http://bitsofproof.com/

Furthermore the CEO of Bits of Proof joined CoinTerra as vice president. See: https://www.prnewswire.com/news-releases/cointerra-acquires-bits-of-proof-and-welcomes-founder-tamas-blummer-as-vice-president-of-enterprise-software-268883901.html

(2015-01-27) CoinTerra files Bankrupcty. See: https://www.coindesk.com/bitcoin-mining-firm-cointerra-files-chapter-7-bankruptcy

(2015-06-25) Interestingly Bits of Proof get acquired by Digital Assets Holdings on. See: 
1) http://web.archive.org/web/20150801050610/http://bitsofproof.com/
2)https://hub.digitalasset.com/press-release/digital-asset-acquires-hyperledger-following-prior-acquisition-of-bits-of-proof"
10117,BitSabio,01/10/2015,Private,@BitSabio,http://web.archive.org/web/20160809062433/http://bitsabio.com/,01/10/2015,,08/11/2017,Defunct,R,,Unidentified,,Unidentified,Unidentified,Native,193713700,Consulting Services; Small Shop for Bitcoin-related security products,,TRUE,
10119,BitSent,01/01/2014,Private,@BitSent,http://web.archive.org/web/20180310121157/http://bitsent.ca/,15/11/2013,830534632,,,,"Waterloo, Ontario",Canada,"Waterloo, Ontario",Canada,Canada,Native,"2014-01-01:101011100,101021200,193713700,193713702,111301200;
2015-01-01:101011100,101021200,193713700,193713702,111301200,131901702,131901705","Brokerage Services; Bitcoin ATM Operator; Consulting; Education and Training; Payment Processor; Mining Pool? (2015?); Hosted Ming Datacenter (2015); ""Bitrated Program"" (2015)",,TRUE,
10123,BitSpend,03/03/2013,Private,@BitspendDotNet,http://web.archive.org/web/20130524021251/https://bitspend.net/,03/06/2013,"
L13000034498",01/08/2013,"Accounts closed by Chase bank, Domain Acquired",R,Florida,United States,Florida,United States,United States,Native,111301202,Proxy-Buyer Service (eCommerce),2013-05-24:4,,Former Legal Name: Bitspend LLC
10124,"2016-04-01:""Bitsquare"";
2017-06-01:""Bisq""",01/04/2016,Private,@bisq_network,https://bisq.network/,,,,,,,DAO,,DAO,,Native,101011103,Open-Source Decentralized Multi-Coin Exchange,Open Source Community,TRUE,"Bisq is not a company or legal entity of any kindâ€”instead, it's organized as a DAO"
10125,Bitstake,01/01/2015,Private,@bitstake,http://web.archive.org/web/20151006152207/https://bitstake.co/,01/12/2014,RC 1271038,30/10/2015,"Shut down, no reasons found",R,Ogun,Nigeria,Ogun,Nigeria,Unidentified,Native,"101011100,111311302,173103000,173113100","Brokerage Services; Money Transfer Platform/Remittances; P2P Lending Platform, Staking platform (Interest bearing account & Staking)",,TRUE,"Legal Name: BITSTAKE GLOBAL LIMITED (according to bitcoin talk thread)
https://bitcointalk.org/index.php?topic=920272.3895;wap
https://ng-check.com/bitstake-global-limited/2809513.html

Bitstake shut down recommended Nariaex (other Nigerian exchange), one article linked linked Bitstake global to it - yet unable to confirm on Nariaex webpage: http://www.itwebafrica.com/e-commerce/694-africa/237034-more-bitcoin-exchange-platforms-now-focus-on-africa"
10126,Bitstamp,01/08/2011,Private,@Bitstamp,https://www.bitstamp.net/,25/07/2012,8157033,,,,London,United Kingdom,London,United Kingdom,United States,Native,101001000,Payment institution; Exchange,"2016-01-01:30;
2017-01-01:180;
2018-01-01:230",TRUE,"Bitstamp Europe S.A., a payment institution authorized and regulated by the Luxembourg financial regulator, the Commission de Surveillance du Secteur Financier (hereafter â€œCSSFâ€), registered with the Luxembourg Trade and Companies Register under the number B0196856, VAT number LU 27823117, with its registered address at 21-25, all?e Scheffer, L-2520, Luxembourg.
Office:New York"
10127,Bitstop,01/01/2014,Private,@BitstopTech,https://bitstop.co/,11/06/2013,"
F18000002477",,,,"Miami, FL",United States,"Miami, FL",United States,United States,Native,101011102,Bitcoin ATM Operator,,TRUE,
10129,Bittrex,01/01/2014,Private,@BittrexGlobal,https://international.bittrex.com/,01/01/2014,834977,,,,,United States,,"2014-01-01:""United States"";
2018-11-01:""Malta"";
2019-10-21:""Liechtenstein""","2014-01-01:""United States"";
2018-11-01:""Malta"";
2019-10-21:""Liechtenstein""",Native,"2014-01-01:101001000;
2019-05-01:101001000,214604201","Multi-Coin Order-book, Margin Trading, IEO (May 2019)",2019-01-01:49,TRUE,"Bittrex Inc. + Bittrex Matla Ltd > Bittrex International which became Bittrex Global in 2019
"
10130,Bittylicious,01/06/2013,Private,@Bittylicious_,https://bittylicious.com/,22/05/2013,8540541,,,,London,United Kingdom,London,United Kingdom,United Kingdom,Native,101001000,"Multi-Coin Brokerage Services, a long history of operating","2016-01-01:1;
2017-01-01:2;
2018-01-01:2;
2019-08-03:3",TRUE,"""No arbitration history to date"""
10131,Bitwage,01/07/2014,Private,@Bitwage,https://www.bitwage.com/,27/05/2014,565031,,,,"San Francisco, California",Ireland,"Kent, Delaware",United States,United States,Native,111311300,Payroll Services,2019-01-16:11,TRUE,https://search.cro.ie/company/CompanyDetails.aspx?id=565031&type=C
10132,Bitwala,01/01/2015,Private,@bitwala,https://www.bitwala.com,26/01/2016,HRB 173698,,,,"2014-09-25:Hengelo; 
2018-01-15:Berlin","2014-09-25:Netherlands; 
2018-01-15:Berlin","2014-09-25:Borne; 
2018-01-15:Berlin","2014-09-25:Netherlands; 
2018-01-15:Germany","2014-09-25:Netherlands; 
2018-01-15:Germany",Native,"2014-01-01:111301201;
2017-01-01:111301201,111301204,121611601;
2018-01-01:111301201,111301204,121611601,101011100","Pay Bills via Banktransfer with Bitcoin (2014-present);
Debit Card (2017); 
Bitcoin Wallet [Self-custody software] (2017);
Brokerage services (2018); 
Banking services (non-crypto yet linked directly with wallet 2018)?","2016-01-01:10;
2017-01-01:20;
2018-01-01:24;
2019-08-16:48",TRUE,"Bitwala originates from German founder however the first legal enity was Safaru B.V. behind it: 
https://app.dimensions.ai/details/grant/grant.8104492

Former websites
1. (bitwa.la) (2014 - 2016): http://web.archive.org/web/20150214031039/http://bitwa.la/
2.(Bitwala.io) (2017)



https://www.unternehmensregister.de/ureg/result.html;jsessionid=C737B543C56DFEB7D4715FB181256450.web03-1

Safaru B.V - Former Payment processor (Dutch - 61533300) - Listed as address in 2016"
10133,BitWall,01/10/2013,Private,@BitWall,http://get.watchout.world/bitwall/,18/07/2013,5369168,13/06/2018,"Acquired by Watch Out!, Inc.",A,"San Francisco, California",United States,"San Francisco, California",United States,United States,Native,111321401,Paywalls for Publishers: Microtransactions,,TRUE,
10134,"2012-04-17:""Valmont Internet""
2013-03-01:""BitX"";
2017-01-11:""Luno""",01/03/2013,Private,@lunomoney,https://www.luno.com,17/04/2012,201209545R,,,,"2012-04-17:""Singapore"";
2018-01-01:""London""","2012-04-17:""Singapore"";
2018-01-01:""United Kingdom""",Singapore,Singapore,Singapore,Native,"2013-03-01:101001000;
2014-01-01:101001000,121601500,111301200;
2016-01-01:101001000,121601500,111301200,101011101",Exchange; Mobile Wallet (2014); Payment Processor (2014); OTC (2016),"2016-01-01:25;
2017-01-01:50;
2018-01-01:100;
2019-08-20:280",TRUE,"Based in Singapore, but originally from South Africa, very active in African and Asian markets. Acquired in October 2013 by ""Switchless"", however still operating under old brand name and few information available about ""Switchless"" --> not included (http://web.archive.org/web/20131102070203/https://switchless.com/).

Switchless devision of FireID (Incubator) - http://web.archive.org/web/20131109110459/http://www.fireid.com/ & still live www.fireid.com but (think) not active

3 REGISTRIES IN Singapore registry: https://www.tis.bizfile.gov.sg/ngbtisinternet/faces/oracle/webcenter/portalapp/pages/TransactionMain.jspx?selectedETransId=dirSearch#%40%3FselectedETransId%3DdirSearch%26_adf.ctrl-state%3Deq5049psd_9

Legal Name: Luno Pte. Ltd. (2012 0954 5R)

Local Branches: 
Indonesia: PT Luno Indonesia Ltd (4014111731102609)
Malaysia: Luno Malaysia Sdn. Bhd. (1136927 A)
Nigeria: BitX Payments Limited (RC1216337)
South Africa: Luno (Pty) Ltd (2013/075107/07)
Uganda: Luno Technology Uganda Limited (80020001421135)
United Kingdom: Luno Money Limited (10388856)
Zambia: Luno Technology Zambia Ltd (120180009295)"
10135,"2014-05-01:""BitXatm"";
2019-03-19:""SumoATM""",01/05/2014,Private,@bitxatm,https://sumoatm.com/,22/11/2017,11077305,,,,London,United Kingdom,London,United Kingdom,United Kingdom,Native,101021200,Bitcoin ATM Manufacturer with integrated POS System,,TRUE,
10136,Bity,01/01/2014,Private,@bity,https://bity.com/,03/02/2014,CHE-329.301.814,,,,Neuch?tel,Switzerland,Neuch?tel,Switzerland,Switzerland,Native,"2015-01-01:121611601; 
2015-03-01:121611601,101011100; 
2015-09-01:121611601,101011100,101011101; 
2018-12-01:121611601,101011100,101011101,101011102; 
2018-01-01:121611601,101011100,101011101,101011102,111301201; 
2019-02-01:121611601,101011100,101011101,101011102,111301201,131911801; 
2019-02-01:121611601,101011100,101011101,101011102,111301201,131911801,193703603",2015-01:Bitcoin wallet; 2015-03:Brokerage Services; 2015-09:OTC Trading; 2018-12-dd:Bitcoin ATM Operator; 2018-mm-dd:Bill payment; 2019-02-dd:Staking services; 2019-02-dd:KYC/AML services,,TRUE,"Responded to email survey that they are ""not interested""."
10137,bitZino,09/06/2012,Private,@bitzino,http://web.archive.org/web/20130805101907/https://bitzino.com/,,,01/12/2016,Defunct,R,Unidentified,Unidentified,Unidentified,Unidentified,Unidentified,Native,162822805,Online Casino,,TRUE,https://web.archive.org/web/20130807175917/https://bitzino.com/about/news
10141,Block.io,01/08/2014,Private,@blockio,https://block.io/,07/07/2014,5564182,,,,"San Francisco, California",United States,Delaware,United States,United States,Native,"121611601,152512303","Multi-Coin Wallet; API Developer; Multi-Coin Block Explorer ""SoChain""",,TRUE,"Legal Name: Block.io, Inc.

https://businesssearch.sos.ca.gov/CBS/Detail"
10142,"2016-07-01:""Blockai"";
2017-05-01:""Binded""",01/05/2014,Private,@binded,https://binded.com/,31/01/2014,5474600,10/09/2019,Acquired by Pixsy,A,"San Francisco, California",United States,"Wilmington, Delaware",United States,United States,Native,"121601500,204003901","Wallet ""QuickCoin""; Time-Stamping Browser (2015)",,TRUE,"Founder initially started a project called ""Quickcoin"", but then turned around in June 2014 and built ""Blockai"", the ""Netscape for Bitcoin"""
10143,BlockC,01/01/2015,Private,,http://www.blockc.co/,01/01/2015,Unidentified,01/01/2016,Unlcear- URL excluded from wayback machine,R,Unidentified,Unidentified,Unidentified,Unidentified,Unidentified,Native,131901706,Distributor of Avalon mining hardware --> Shop (resale?),,TRUE,
10147,BlockJockey,01/01/2015,Private,@BlockJockeyApp,http://blockjockey.com/,27/08/2007,HRB 102174,,,,Hamburg,Germany,Hamburg,Germany,Germany,Partial pivot,"152512303,152512302,152512304,152512301","Mobile Block Explorer/Analytics,Network Statistics, Data Aggregation, Market data",,TRUE,Gryphos GmbH is began in the provision of services in the field of business organization consulting and related business before developing BlockJockey
10148,Blockr.io,01/01/2013,Private,@blockr_io,http://web.archive.org/web/20140914203736/http://blockr.io/,01/01/2013,,01/08/2014,Acquired by Coinbase,A,Unidentified,Unidentified,Unidentified,Unidentified,Unidentified,Native,152512303,Blockchain Explorer,,TRUE,
10149,"2013-08-01:""BlockScore"";
2019-09-03:""Cognito""",01/08/2013,Private,@getcognito,https://blockscore.com/,03/06/2013,5344022,,,,California,United States,Delaware,United States,United States,Native,193703603,Identity Verification/Anti-Fraud Services,2019-08-17:67,TRUE,
10152,BlockTrail,01/01/2014,Private,@blocktrail,http://web.archive.org/web/20170425200845/https://www.blocktrail.com/#,19/03/2014,NL853833035B01,19/07/2016,Aquired by Bitmain - rebranded as BTC.com,A,Amsterdam,Netherlands,Amsterdam,Netherlands,Unidentified,Native,"2014-01-01:152512303;
2015-01-01:152512303,121611601;","Block Explorer (2014), Bitcoin API (2014), Developer Platform (2015); Wallet (2015);","2016-04-23:7;
2017-04-23:3",TRUE,"Legal Name: BlockTrail B.V.

Interesting case: Has ben acquired by bitmain 2016-07-01. The service contiuned to run until integrated into BTC.com. 2019-03-04 got rekt by bitmain as integrated into BTC.com complete 

http://web.archive.org/web/20170216061259/https://blog.blocktrail.com/2016/07/blocktrail-is-now-a-part-of-the-bitmain-family/"
10153,Bonafide,01/05/2014,Private,@bonafideIO,http://web.archive.org/web/20150927040033/https://bonafide.io/,08/04/2014,5513134,01/11/2015,"Not enough interest in their product, shut down",R,"San Francisco, California",United States,Delaware,United States,United States,Native,193723800,Identity & Reputation System,,TRUE,"Bitcoin reputation startup Bonafide has elected to cease operations and commence liquidation less than one year after raising $850,000 from investors including Blockchain Capital and Quest Venture Partners."
10155,Brawker,01/04/2014,Private,@brawker,http://web.archive.org/web/20141219131628/https://brawker.com/,15/11/2013,1997376,14/04/2015,Shut down due to low growth and increased workload,R,Unidentified,Unidentified,Hong Kong,Hong Kong,Unidentified,Native,111301202,Proxy-Buyer platform to buy anything on the Internet with Bitcoin,,TRUE,
10156,Breadwallet,01/06/2014,Private,@BRDHQ,https://brd.com/,03/05/2017,CHE-357.612.662,,,,Zurich,Switzerland,Schwyz,Switzerland,Switzerland,Native,121611601,Mobile Wallet (Self-custody),2019-07-08:40,TRUE,"Japanese financial services giant SBI Groupâ€™s crypto subdepartment SBI Crypto Investment Co., Ltd., has invested in crypto-focused digital wallet Breadwinner AG (BRD). SBI Group is a public company. Their parent company was SoftBank until 2006.
, the first binance ""launchpad"" (IEO) project, conducting a successful raise on the binance platform (12/2017)"
10157,bridge21,26/06/2014,Private,@bridge21inc,https://bridge21.com/,26/06/2014,5559302,,,,Denver,United States,Delaware,United States,United States,Native,"111311302,111311301","Money Transfer Platform Mexico/USA, Survey data indicates ""General-purpose money transfer"", ""B2B cross-border payments"",""Personal remittances""",2019-08-21:6,TRUE,"bridge21 Inc. was formerly known as Novauri LLC. Novauri was the first company in the world to let customers buy and sell digital currencies while controlling their wallets and private keys. bridge21 acquired ChainID LLC, an intellectual property holding company, in 2015. bridge21 Inc. was founded in 2014 and is based in Denver, Colorado."
10158,Bridgewalker,01/03/2013,Private,@bridgewalkerapp,https://www.bridgewalkerapp.com/,01/01/2013,,18/11/2013,Acquired by Hive: https://www.coindesk.com/bitcoin-wallet-hive-purchases-android-app-bridgewalker,A,,Germany,,Unidentified,Unidentified,Native,121601500,Hedged Account Wallet,"2013-01-01:1
2015-01-01:1",,https://www.bridgewalkerapp.com/blog/2014/03/14/bridgewalker-shutdown/
10159,BSAVE,01/01/2016,Private,@bsave_io,https://web.archive.org/web/20171106173045/https://www.bsave.io/,24/07/2015,9701082,23/03/2019,Acquired by Celcius,A,London,United Kingdom,London,United Kingdom,United Kingdom,Native,173113100,Bitcoin Savings Account Platform,2019-08-13:31,,
10160,BTC Gear,01/07/2012,Private,@BTCGear,http://web.archive.org/web/20140726132110/http://btcgear.com/,01/01/2012,,01/01/2014,"Founder was thinking about selling company, since then no information --> considered shut down",R,"Carslbad, California",United States,Unidentified,Unidentified,Unidentified,Native,111301202,Shop/Proxy-Buyer Platform to buy anything on the Internet with bitcoin,,,
10161,BTC Guild,01/05/2011,Private,,http://web.archive.org/web/20110806102548/http://btcguild.com/,01/05/2011,,30/06/2015,"Defunct, threat of BitLicense, shrinking profitability",R,"New York City, New York",United States,Unidentified,United States,United States,Native,131901705,Mining Pool,,,
10162,BTC Media,01/01/2013,Private,@btcmediaorg,https://b.tc/,20/06/2014,5552734,,,,"Nashville, TN",United States,Delaware,United States,United States,Native,"162812700,162822800,162822801,193723801,193723802","Media: ""Bitcoin Magazine"" and ""ybitcoin"", Podcast, Marketing/Communication Strategy, Community Management, Event",,TRUE,https://tnbear.tn.gov/Ecommerce/FilingDetail.aspx?CN=044029207164051059051245101029196051247151037214
10165,BTC Oracle,01/04/2013,Private,@btcoracle,http://web.archive.org/web/20160109061509/http://btcoracle.com/,01/01/2013,,29/07/2017,Hello dear visitor. Our service will be shut down soon. All opened options will be dealt with as usual but no new option will be accepted. Thank you all for your support and loyalty.,R,Unidentified,Unidentified,Unidentified,Unidentified,Unidentified,Native,"101011100,183423500","Binary Options Broker Website, oracle",,TRUE,
10166,BTC Trinkets,01/11/2012,Private,@BTCTrinketscom,,01/01/2012,,16/07/2018,"Appears Defunct, Domain Expired",R,Helsinki,Finland,Helsinki,Finland,Finland,Native,111301203,Bitcoin Niche Items Shop,,,
10167,BTC Trip,01/06/2013,Private,@btctrip,https://btctrip.com/,01/01/2013,,01/01/2017,,R,"San Francisco, California",United States,Florida,United States,United States,Native,111301203,Bitcoin Travel Agency,,TRUE,
10170,"2015-01-01:""BTCexpress"";
2019-03-12:""Xentum""",01/01/2015,Public,,http://www.xentum.ch/,07/12/2017,CHE-428.565.073,,,,Baar,Switzerland,Zug,Switzerland,Switzerland,Native,101011100,"Brokerage Services, Payment processing(?)",,TRUE,
10171,BTCjam,01/01/2012,Private,@btcjam,btcjam.com,01/01/2012,,01/05/2017,"""Regulatory challenges around Bitcoin and the difficulties we faced in introducing Bitcoin technology to poor communities around the world are simply beyond our capacity"".",R,,United States,,United States,,Native,173103000,P2P Lending Platform,,TRUE,
10172,BTClevels,01/07/2013,Private,@BTClevels,https://web.archive.org/web/20180420221232/https://www.btclevels.com/,01/01/2013,,14/01/2019,Defunct,R,Unidentified,Unidentified,Victoria,Seychelles,Seychelles,Native,101001000,Bitcoin Binary Options Platform,,TRUE,Legal name: Trust Financial Systems inc.
10173,BTCPoint,01/01/2015,Private,,http://www.btcpoint.nl/index.html,01/01/2014,71470808,,,,Hootn,Netherlands,Hoorn,Netherlands,Netherlands,Native,"101021200,193713700","Bitcoin-to-Cash Service via local bank ATM network, consultancy",,TRUE,
10175,BTCXIndia,05/05/2014,Private,https://twitter.com/btcxindia,https://www.btcxindia.com/,25/11/2013,U67190AP2013PTC091266,05/03/2018,Operations halted due to unfavourable government stance,R,Hyderabad,India,Hyderabad,India,India,Native,101011100,Brokerage services,,TRUE,Domain dysfunctional. Legal name
10176,Bter,01/01/2013,Private,https://twitter.com/btercom,bter.com,01/01/2013,Unidentified,01/12/2017,"Defunct, closed ""in compliance with local policy in China"" very sad",R,"Jinan, Shandong",China,,British Virgin Islands,Unidentified,Native,101001000,Multi-Coin Exchange,,TRUE,Parent company: MaxCloud Inc.Popular between 2013 and 2017
10178,BTX Trader,01/01/2013,Private,,,01/01/2013,5442818,01/12/2013,"Acquired by ""WPCS""",A,"New York City, New York",United States,"Wilmington, Delaware",United States,United States,Native,101001000,Trading Platform,,TRUE,
10180,Buttercoin,01/01/2013,Private,@Buttercoin,,01/01/2013,5630551,15/04/2015,Filed for bankruptcy due to lack of funding,R,"Palo Alto, California",United States,"Wilmington, Delaware",United States,United States,Native,101001000,Exchange,,TRUE,
10181,Butterfly Labs,01/01/2012,Private,@ButterflyLabs,,01/01/2011,,01/09/2014,"Lawsuit against founder for fraud, no activity since then.",R,Kansas,United States,Kansas,United States,United States,Native,"131901700,131901703",Mining Hardware (ASIC); Cloud Mining,,TRUE,
10182,BuyBitcoin.ph,01/01/2014,Private,@BuyBitcoinPH,https://www.buybitcoin.ph/,01/01/2013,,,,,Manila,Philippines,Manila,Philippines,Philippines,Native,"2014-01-01:101011100;
2015-02-01:101011100,111311302,111301201;
2016-01-01:101011100,111311302,111301201,121601500","Brokerage Services, Remittance (""Rebit.ph"",2015-02-01), Bill payment (""Rebit.ph"",2015-02-01),Third-party mobile wallet (""Bitbit.ph"", 2016-01-01)",,TRUE,acquired by https://sci.ph/ Rebittance Inc. A wholly owned subsidiary of Satoshi Citadel Industries (see:http://www.bsp.gov.ph/banking/MSBs.pdf) in 2015-04-01
10184,CampBX,01/01/2011,,@CampBX,,01/01/2011,,13/11/2017,Defunct,R,"Atlanta, Georgia",United States,"Atlanta, Georgia",United States,United States,Native,101001000,"Exchange; Trading Platform (2013: Short-Selling, Margin Trading)",,,
10185,Canaan,01/01/2013,"2013-01-01:""Private"";
2019-11-29:""Public""",@canaanio,https://www.canaan.io/,01/03/2012,,,,,Beijing,China,"2013-01-01:""Beijing"";
2015-01-01:""Hangzhou"";
2018-02-01:""Grand Cayman""","2013-01-01:""China"";
2018-02-01:""Cayman Islands""",Unidentified,Native,"131901703,131901702","""Avalon"" Mining Hardware; Cloud Mining",,TRUE,https://www.sec.gov/Archives/edgar/data/1780652/000119312519276263/d773846df1.htm#rom773846_1
10186,Card for Coin,01/05/2014,Private,@cardforcoin,,01/02/2014,4083494,30/08/2019,Defunct Soon,R,California,United Kingdom,"Wilmington, Delaware",United States,United States,Native,111301204,"Get Bitcoin for Gift Cards; ""Fold"": Get Gift Cards at Starbucks & Walmart with discounts for bitcoins",,TRUE,"""CardForCoin will be shutting down operations."""
10187,Casascius,01/09/2011,Private,,https://casascius.com/,25/02/2013,8591587-0160,01/12/2013,"Preliminarily Shut down in anticipation of regulation issues with FinCEN, Now active again.",R,Utah,United States,"Sandy, Utah",United States,United States,Native,162822804,"Physical bitcoins ""manufacturer"" and seller (Collectible). As of 2013 does not sell Bitcoin, only metal coins. Therefore pivoted away from crypto.",,TRUE,
10188,Case,02/03/2015,Private,@CaseWallet,http://web.archive.org/web/20150709225419/https://choosecase.com/,02/03/2015,5701912,31/07/2017,Same Legal enity is now offering Tokenrings,P,Rochester,United States,Delaware,United States,United States,Native,121611602,Hardware Wallet,,TRUE,"Quieted pivot --> Website still live and accessible (however no SSL Certficate for websites) hence back to safety. Website indicates a slow closure (no SSL certifcate & Sold out). 
Operate now as: https://tokenring.com/
https://www.sec.gov/Archives/edgar/data/1637506/000163750618000002/xslFormDX01/primary_doc.xml
Tokenize Inc, which was formerly know as Case Wallet Inc"
10189,Cash To Crypto,01/01/2013,Private,http://web.archive.org/web/20141014084231/https://twitter.com/CashToCrypto,http://web.archive.org/web/20181002222348/http://www.cashtocrypto.com/,01/01/2013,14005385,06/11/2014,Defunct,R,Atlanta,United States,Atlanta,United States,United States,Native,"2014-01-01:101011100;
2016-01-01:101011100,101021200","(2014) Brokerage Services (only sell bitcoin, no buying), ATM Provider (2016)",,TRUE,"https://ecorp.sos.ga.gov/BusinessSearch/BusinessInformation?businessId=1897165&businessType=Domestic%20Limited%20Liability%20Company&fromSearch=True

http://bittrust.org/cash-to-crypto/6"
10190,Cash2BTC,01/01/2014,Private,@Cash2BTC,http://web.archive.org/web/20140803212858/http://cash2btc.com/,,,01/01/2016,Defunct,R,Unidentified,United States,Unidentified,United States,Unidentified,Native,101011102,Portable ATM manufacturer (DIY),,TRUE,Comes from the Cyperpunk movement // Goiverned by laws of Colorado (http://web.archive.org/web/20140804234939/http://cash2btc.com/terms.php)
10191,Cashila,01/01/2014,Private,@cashilacom,http://web.archive.org/web/20141219050043/https://www.cashila.com/,04/12/2014,3621111,01/06/2017,"Defunct, formally closed to found Iconomi",R,Pitkovice,Czechia,Pitkovice,Czechia,Czechia,Native,"2014-01-01:111301201;
2015-01-01:111301201,111311302,111311300",Payment Processor,,,
10192,Cavirtex,01/06/2011,Private,,,01/01/2011,4519331,01/04/2015,"Acquired by ""Coinsetter"", after shutting down operations in February 2015 following a security breach. Later Coinsetter acquired by Kraken.",A,"Calgary, Alberta",Canada,Unidentified,Unidentified,Canada,Native,101011100,Exchange; API interface,,,Ultimately acquired by Kraken on 19/01/2016
10202,Circle,01/02/2014,Private,@circlepay,https://www.circle.com,07/08/2013,"531058
",,,,"Boston, Massachussetts",United States,Dublin,Ireland,Ireland,Native,"2014-02-01:121601500,111311302,101011100;
2017-11-01:121601500,111311302,101011100,101011101;
2018-02-26:121601500,111311302,101011100,101011101,152532500,101001000;
2018-09-26:121601500,111311302,101011100,101011101,152532500,101001000,214604200;
2018-10-05:121601500,111311302,101011100,101011101,152532500,101001000,214604200,214304100;
2019-10-18:121601500,111311302,101011100,101011101,214604200,214304100;","Wallet (Deslktop, Mobile, Web, Third party, 2014); Brokerage Services; Insured Accounts; Money Transfer Platform/ Remittances (""Circle Pay"", 2014); Research arm (""Circle Research"" 2018, paused in October 2019), OTC (""Circle Trade"", 11/2017), Order-book (""Poloniex"", 26/02/2018 until 18/10/2019), Investment (""SeedInvest"", Acquired 05/10/2018), Token issuer (USDC, 26/09/2018)","2017-01-01:147;
2018-01-01:250;
2019-05-01:270",TRUE,"Parent company: Circle Internet Financial Ltd (Irish)
Several subsidiaries: Poloniex, Circle Pay, Circle USD, Circle Internet Financial, Inc., a Delaware corporation (5381921, incorporated on 12/08/2013)
Also have office in: Hong Kong, France, UK, Italy
525701;
540941"
10212,Coin Sciences,01/01/2014,Private,@CoinSciences,https://www.multichain.com/about-coin-sciences-ltd/,20/03/2014,8950954,01/01/2015,Pivoted towards enterprise blockchain,P,Tel Aviv,Israel,London,United Kingdom,United Kingdom,Native,"204003900,152512303","Open-Source Colored Coins Platform ""CoinSpark""; Bitcoin Metadata (OP_Return) Explorer ""Coin Secrets""; Pivot towards Customized Blockchains ""Multichain"" (2015)",,TRUE,"We develop MultiChain (www.multichain.com), the popular open source blockchain platform, used for client project development by over 100 partners including Accenture, PricewaterhouseCoopers and SAP."
10214,Coin-Swap,01/12/2013,Private,@coinswapnet,https://web.archive.org/web/20150124053556/https://coin-swap.net/,01/01/2014,,22/03/2015,"Sold to ""GAW Miners"" who used its trading engine for their Paycoin Exchange",A,"Tampa, Florida",United States,Unidentified,Unidentified,Unidentified,Native,101001000,Multi-Coin Exchange (without account/wallet),,,
10215,Coin.co,15/04/2014,Private,,https://web.archive.org/web/20170716213408/https://coin.co/,16/01/2014,4514583,01/09/2017,"Operations ceased temporarily, however, website still active.",R,NY,United States,New York,United States,United States,Native,111301200,Payment Processor (Merchant services),,TRUE,
10216,Coin.mx,01/03/2013,Private,@coin_mx,http://coin.mx/,01/01/2013,,01/07/2015,Founders arrested by FBI for money laundering charges for operating an illegal bitcoin exchange in violation fo federal anti money laundering laws.,R,Florida,United States,Florida,United States,United States,Native,"111301200,101001000","Exchange, merchant processing",,,"Information about operations can be found here: https://regmedia.co.uk/2017/06/27/murgiosentencingsubmission.pdf
Disguised as 'private membership association' of collectibles for the period of operation."
10217,Coinabul,01/10/2011,Private,@coinabul,https://web.archive.org/web/20130328004725/http://coinabul.com/,15/07/2010,2010-000587282,08/09/2015,"Class action lawsuit in 2014 for alleged fraud (last shipments made in June 2013, but accepting incoming orders and payments later --> no information available since then",R,Unidentified,United States,Wyoming,United States,United States,Native,101011100,Bitcoin-to-Gold/Silver Service,,,Incoporation number available here: https://wyobiz.wy.gov/business/FilingDetails.aspx?eFNum=184091123241020161231070245047214108020047212114
10219,"Coinapult
",01/04/2012,Private,@Coinapult,https://web.archive.org/web/20180224041832/https://coinapult.com/,01/01/2012,,01/12/2018,"Integrated with Crypto Capital in 2015, now defunct (01/12/2018: Defunct_",R,Panama,United States,Panama,United States,Panama,Native,"2012-04-01:121601500,101011100;
2014-01-01:121601500,101011100,111301200","Wallet (including ""Send-by-SMS/e-mail""); Brokerage Services; Price Hedging (""Locks"", 2014); Payment Processor (2014)",,TRUE,
10220,Coinarch,01/01/2014,Private,@coinarch,https://www.coinarch.com/,01/01/2014,,01/11/2015,"Shut down website after previous announcement to customers, no reason given",R,Singapore,Singapore,Singapore,Singapore,,Native,101001000,"Bitcoin Trading and Investment Products (Derivatives; Margin Trading; Interest-bearing accounts, etc)",,TRUE,"The website lists 'trading solutions' as its activity, not exactly sure which ""type"" of activities"
10221,Coinbase,20/06/2012,Private,@coinbase,https://www.coinbase.com/,14/05/2012,5154317,,,,San Fransciso,United States,"Wilmington, Delaware",United States,United States,Native,"2012-06-20:101011100,121601500;
2013-01-01:101011100,121601500,152512301,111311302;
2014-01-01:101011100,121601500,152512301,111311302,152512303;
2015-01-01:101011100,121601500,152512301,111311302,152512303,101001000;
2015-11-01:101011100,121601500,152512301,111311302,152512303,111301204,101001000;
2017-09-04:101011100,121601500,152512301,111311302,111301204,101001000;
2018-02-14:101011100,121601500,152512301,111311302,111301204,101001000,111301200;
2018-12-01:101011100,121601500,152512301,111311302,111301204,101001000,111301200,193713702;
2019-04-16:101011100,121601500,152512301,111311302,111301204,101001000,111301200,193713702,121601501;
2019-11-06:101011100,121601500,152512301,111311302,111301204,101001000,111301200,193713702,121601501,131911801","Wallet; Brokerage Services (""Coinbase""); General API Provider (2013); Money Transfer Platform (2013); Blockchain Explorer (""Blockr.io"", 18/08/2014, until 04/09/2017); Insured Accounts (2014); Exchange (""GDAX"">""Coinbase Pro"", 2015), Debit card (""Coinbase Card"", first 11/2015 in the US, in the UK from 2019-04-11), Education and Training (""Earn"", 12/2018), Merchant Services (""Commerce"", 14/02/2018), Staking-as-a-Service (06/11/2019), Custody for institutional (Vault, 2019/04/16)","2016-01-01:150;
2017-01-01:200;
2018-01-01:300;
2019-01-01:500",TRUE,
10224,CoinCorner,01/07/2014,Private,@CoinCorner,https://www.coincorner.com,18/06/2014,129003C,,,,,,Douglas,Isle of Man,Isle of Man,Native,"2014-01-01:111301200,101001000;
2019-01-01:111301200,101001000,111301204","2014 - Exchange, Merchant Service
2019 - Debit Card, Gift cards",,TRUE,"They have a host of new features like crypto visa cards etc. lined up, so please recheck at the time of final use of this database."
10225,CoinEX (Russia),01/01/2013,Private,,,01/01/2013,,01/04/2014,"Got hacked in March, tried to recover users' funds --> no sign of activity since April 2014. Back up and running in 2019",R,,Russia,,Unidentified,Unidentified,Native,101001000,Multi-Coin exchange,,TRUE,
10227,Coinify,03/09/2014,Private,@coinify,https://coinify.com/,01/01/2014,35847995,,,,Herlev,Denmark,Herlev,Denmark,Denmark,Native,"101011100,111301200,101011101","Brokerage Services (""myConify""); OTC; Merchant Services (""Coinify Merchant""); API Provider","2016-01-01:15;
2017-01-01:20;
2018-01-01:40
",TRUE,
10229,Coincube,01/05/2015,Private,@coincube,https://coincube.io/,18/08/2014,5588571,12/08/2017,"""coincube has just closed its service. They did not manage to live on it. They will make the open source code available to the community by the end of September.""",R,NY,United States,Delaware,United States,Unidentified,Native,"214304100,101001003","Automated Bitcoin Trading/Investment, Market Making Portfolio management",2019-01-01:4,TRUE,"Platform now open source and looking for other platforms to be integrated with

Frpm when they were not opensource
http://web.archive.org/web/20161014183948/https://coincube.io/"
10230,CoinDesk,01/05/2013,Private,@coindesk,https://www.coindesk.com/,11/04/2013,5086263,,,,NY,United States,London,United Kingdom,United States,Native,"162812700,162822801,152532500,152512301","Media; Analytics & Data (Market Data), Events (""Consensus"", Research",,TRUE,"Enity in 2013: CoinDesk Ltd
2016-01-13:Acquired by Digital Currency Group"
10232,Coinfinity,01/03/2014,Private,@coinfinity,https://coinfinity.co/start-en/,23/04/2014,415803A,,,,Graz,Austria,Graz,Austria,Austria,Native,"2014-01-01:193713700,101021200;
2015-01-01:193713700,101011100,101021200,111301200;
2018-01-01:193713700,101011100,101021200,111301200,101011101,121611603","Consulting; ATM Operator; Brokerage Service (2015); Gift card (""BitcoinBon"",2015);Merchant Services(2015); Cardwallet (Fancy paper wallet form my understanding offered through cardwallet,com) (2018); OTC (2018) Investment Services (custody & Strategie) (?)",,TRUE,
10233,Coinfloor,01/03/2013,Private,@coinfloor,https://www.coinfloor.co.uk/,18/04/2013,8493818,,,,London,United Kingdom,London,United Kingdom,United Kingdom,Native,"2013-03-01:101001000,101011101;
2018-01-01:101001000,101011101,121601501",Exchange (Order Book); OTC (Trading); Corporate Trading services; Coinfloor API; Vault services (2018-01-01),,TRUE,
10234,CoinGecko,01/04/2014,Private,@coingecko,https://www.coingecko.com/en,15/04/2015,UEN 201510008G,,,,Singapore,Singapore,Singapore,Singapore,Singapore,Native,"2014-01-01:152512300,152512301,152512302;
2017-01-01:152512300,152512301,152512302,152522400","Data/Analytics, specifically market and price information. Directories 
Industry research (2017)",2019-11-24:13,TRUE,
10235,Coinhills,21/08/2014,Private,@coinhills,https://www.coinhills.com/,,,,,,Seoul,South Korea,Unidentified,Unidentified,Unidentified,Native,"152512300,152512301,152512302","Media/Data, API",,TRUE,
10236,Coinigy,01/02/2014,Private,@coinigy,https://www.coinigy.com/,02/05/2014,C089478,,,,Wisconsin,United States,Winsconsin,United States,United States,Native,"101001005,214304100","Charting, Trading and Portfolio Management Platform (Data/Analytics and Trading Platform)","2016-01-01:5;
2017-01-01:15;
2018-01-01:20",TRUE,Legal Name: Coinigy Inc.
10238,Coinizy,01/11/2012,Private,@coinizy,http://web.archive.org/web/20160604042511/https://www.coinizy.com/,01/03/2014,BC1019811,01/05/2017,"Also called Kardiz. Turned out to be a scam, inactive since mid 2017",R,,Canada,Vancover,Canada,Unidentified,Native,"101011100,111301204",Bitcoin-to-Fiat Only Service; Debit Cards,,TRUE,"Legal Name: COINIZY FINANCIAL SERVICES INC. 
Kardiz.com: http://web.archive.org/web/20170603213304/https://www.kardiz.com/"
10240,CoinJelly,01/01/2014,Private,,http://web.archive.org/web/20140625035503/http://coinjelly.com/,01/12/2013,168 874 388,12/12/2014,"Apparently sold to another, undisclosed company, but shut down user accounts: no sign of activity since",,Brisbane,Australia,Brisbane,Australia,Australia,Native,"101011100,111301204,121601500","Wallet/Money Transfer Platform; Brokerage Services, Debit Cards",2014-06-25:4,TRUE,"Legal Name: COINJELLY PTY LTD
https://abr.business.gov.au/ABN/View?id=168874388

Stated that they had insured accounts, however this turned out not to be true"
10241,CoinJournal,01/08/2015,Private,@CoinJournal,https://coinjournal.net/,,,,,,Manchester,United Kingdom,,United Kingdom,Unidentified,Native,162812700,Media/News,,TRUE,
10243,CoinMama,01/05/2013,Private,@Coinmamacom,https://www.coinmama.com/,27/01/2017,50677373,,,,Ranaana,Israel,Bratislava,Slovakia,Slovakia,Native,101011100,Brokerage Service,2019-01-01:33,TRUE,"Owned by New Bit Ventures Ltd (which is a company registered in Israel 514907880) 
https://www.israelbizreg.com/new-bit-ventures-ltd
Operated by NBV INTERNATIONAL s.r.o."
10244,CoinMap,01/04/2013,Private,@coinmap,https://coinmap.org/,01/04/2013,,13/06/2015,"Under umbrella firm ""SatoshiLabs""",A,Prague,Czechia,Prague,Czechia,Czechia,Native,152512300,Map showing businesses accepting bitcoins (Directory),,TRUE,
10245,CoinMkt,13/04/2013,Private,@coinmkt,http://web.archive.org/web/20150316124528/https://coinmkt.com/,,,29/01/2015,"Acquired by ""ANX""",A,"Los Angeles, California",United States,"Los Angeles, California",United States,,Native,101001000,Exchange,,TRUE,
10246,Coinmotion,01/01/2014,Private,@coinmotion,https://coinmotion.com/,17/09/2013,2571525-6,,,,Jyv?skyl?,Finland,Helsinki,Finland,Finland,Native,"2014-01-01:101001000,121601500;
2019-01-01:101001000,121601500,111301200,101001003",Brokerage (2014); Storage (Wallet) (2014); Merchant services (2019); Third party trading services (Crypto privat banking) (2019),,TRUE,"2016-02-01: Acquired by ""Prasos"""
10247,Coinmetrics,01/12/2017,Private,@coinmetrics,https://coinmetrics.io/,09/07/2018,1345098,,,,Massachusetts,United States,Massachusetts,United States,United States,Native,"152512304,152512301,",Market and Network Analytics & Data/Blockchain Intelligence,,TRUE,"Still active but founder went to ""Chainalysis"""
10248,Coinomi,01/01/2014,Private,@coinomiwallet,https://www.coinomi.com/,28/10/2016,10451885,,,,Nicosia,Cyprus,London,United Kingdom,Cyprus,Native,121611601,"Multi-Coin Wallet (Built in exhange),",,TRUE,
10249,CoinOutlet,01/08/2014,Private,@coinoutletinc,https://web.archive.org/web/20160223083601/http://coinoutletatm.com/about/,01/01/2014,,01/01/2018,Defunct,R,Pennsylvania,United States,Unidentified,Unidentified,Unidentified,Native,101021200,Bitcoin ATM Manufacturer,,,
10251,CoinPip,14/01/2014,Private,@coinpip,https://www.coinpayments.net/,01/01/2014,UEN 201402300N,,,,Singapore,Singapore,Singapore,Singapore,Singapore,Native,"2014-01-14:111301200;
2015-01-01:111301200,111311302,111311301,111311300;
2018-01-01:111301200,111311302,111311301,111311300,101011101","Payment Processor; B2B Money Transfer Platform (2015); Payroll (2015) Remittances (2015), OTC (2018)","2016-01-01:4;
2017-01-01:6;
2018-01-01:7
",TRUE,
10263,CoinWallet,01/03/2015,Private,@CoinAppWallet,https://www.coin.space/,01/02/2015,,,,,"2015-03-01:""Unidentified"";
2018-01-01:""La Valetta""","2015-03-01:""Unidentified"";
2018-01-01:""Malta""","2015-03-01:""Unidentified"";
2018-01-01:""La Valetta""","2015-03-01:""Unidentified"";
2018-01-01:""Malta""","2015-03-01:""Unidentified"";
2018-01-01:""Malta""",Native,121611601,"Wallet (software wallet, self-custody)",,TRUE,The company does not mention the location anywhere
10285,CryptoCoinsNews,01/01/2013,Private,@ccnmarkets,https://www.ccn.com/,22/01/2015,921 020 880,,,,Unidentified,Unidentified,Asker,Norway,Norway,Native,162812700,Media/News,,TRUE,"By the end of 2018, CCN.com became a part of the Norwegian media company â€œHawkfish ASâ€"
10289,CryptoPanic,01/05/2017,Private,@cryptopaniccom,https://cryptopanic.com/,,,,,,Unidentified,Unidentified,Unidentified,Unidentified,Latvia,Native,152512302,News Aggregator,,TRUE,Not Incorporated
10299,Digital Currency Council,01/09/2014,Private,@DCCCertified,http://www.digitalcurrencycouncil.com/,07/04/2017,5116834,,,,"New York, New York",United States,"New York, New York",United States,United States,Native,193713702,Training and Certifications,,TRUE,
10387,Ledger,01/12/2014,Private,@ledger,https://www.ledger.com/,24/08/2011,5.29991E+13,,,,Paris,France,Paris,France,France,Native,"2014-12-01:121611602;
2017-05-23:121611602,121601501","Hardware Wallet (Ledger Nano), one of the two leading manufacturers, the other being Trezor, Vault (Ledger Vault, 23 May 2017)",2017-01-01:75;2018-01-01:140;2019-01-01:200,TRUE,
10439,PeerNova,01/01/2013,Private,@cloudhashing,,30/05/2014,C3680421,30/05/2014,"Merger with ""HighBitcoin"" to form ""PeerNova""",M,Silicon Valley,United States,Delaware,United States,,Native,131901703,Cloud Mining Contracts,2019-08-22:55,TRUE,
10513,WeExchange,01/07/2011,Private,,https://www.wexchange.com.au/track-order/,22/10/2012,52 155 326 846,01/11/2013,Apparently Exit Scam,R,Victoria,Australia,Victoria,Australia,Australia,Native,101001000,Exchange,,TRUE,"Legal name:WeExchange Australia, Pty. Ltd.
https://www.sec.gov/litigation/complaints/2018/comp24078.pdf"
10607,"2012-01-01:""ItBit"";
2015-01-01:""Paxos""",01/01/2012,Private,@PaxosGlobal,"https://www.paxos.com
",01/05/2015,1766787,,,,"2012-01-01:""Singapore"";
2015-01-01:""New York""","2012-01-01:""Singapore"";
2015-01-01:""United States""","2012-01-01:""Singapore"";
2015-01-01:""New York""","2012-01-01:""Singapore"";
2015-01-01:""United States""",United States,Native,"2012-01-01:101001000;
2015-01-01:101001000,101011101,101011100;
2017-01-01:101001000,101011101,121601501,101011100;
2018-01-01:101001000,101011101,121601500,101011100,214604200","Exchange, OTC Trading, Custody (2017), Brokerage (Escrow), Stablecoin and Gold-backed token(September, 2018), automated trading (post trade), Market data",,TRUE,"First company obtaining a banking trust charter, enabling it to operate in all 50 states in the United States. Incorporated as Paxos Trust Company LLC
Has offices in Singapore, for customers based in Singapore (ItBit PTE Ltd.), London, NYC"
10610,Seba,01/01/2018,Private,@weareseba,https://www.seba.swiss/,24/04/2018,CHE-434.446.643,,,,Zug,Switzerland,Zug,Switzerland,Switzerland,Native,"173103000,173113100",Digital Asset Bank,,TRUE,
10641,Paradigma,01/09/2019,Private,@paradigmaLU,https://www.paradigma.lu/,01/09/2019,,,,,Luxembourg,Luxembourg,Luxembourg,Luxembourg,Luxembourg,Native,193713700,Blockchain consulting firm,1,TRUE,
10642,Polo Digital Asset,21/10/2019,Private,@Poloniex,https://poloniex.com/,Unverified,Unverified,,,,Seychelles,Seychelles,,Bermuda,,Native,"101001000,173103000","Order-book (2019), Margin Trading (2019), Lending (2019)",,TRUE,
10643,B2C2,01/01/2015,Private,@B2C2Group,https://www.b2c2.com/,01/01/2015,10102984,,,,London,United Kingdom,London,United Kingdom,United Kingdom,Native,"101011101,101001002","OTC, liquidity provider","2016-01-01:2;
2017-01-01:25;
2018-01-01:33",TRUE,"Its UK subsidiary, B2C2 OTC Ltd., is now authorised and regulated by the UKâ€™s Financial Conduct Authority to arrange and deal in Contracts for Difference (CFDs)"
10665,Galaxy Digital,31/07/2018,Public,,https://www.galaxydigital.io/,01/02/2006,,,,,New York,United States,Grand Cayman,Cayman Islands,Cayman Islands,Native,"101011100,101011101,101001002,193713700,193713701,214304100","Brokerage services, OTC, Market Making, Portfolio management, Advisory (General Corporate Advisory, M&A, Transaction Advisory, Restructuring, Capital Raising), Industry research",2019-11-06:27,,"https://www.sedar.com/GetFile.do?lang=EN&docClass=5&issuerNo=00023367&issuerType=03&projectNo=02906873&docId=4507119
Reverse Merger - hence filings from 2006"
10670,Castle Island,16/05/2018,Private,@CastleIslandVC,https://www.castleisland.vc/,16/05/2018,6888432,,,,Massachusetts,United States,New Castle,United States,United States,Native,"2018-05-16:214304100;
2019-09-17:162822800,214304100","Venture Capital in Public Blockchain Project, New podcast (""On the brink"", September 2019)",,TRUE,"SEC -Filing: https://www.sec.gov/Archives/edgar/data/1742592/000174259218000001/xslFormDX01/primary_doc.xml

Related entities: 
Castle Island GP I, LLC, Castle Island Management, LLC"
10673,ErisX,01/07/2019,Private,@ErisX_Digital,https://www.erisx.com/,16/10/2017,6579164,,,,Chicago,United States,Chicago,United States,United States,Partial pivot,"101021202,101001000","Clearing house for cryptoassets, Trading platform",,,"Legal Name: Eris Clearing LLC
Subsidary of Eris Exchange LLC (founded 2010-04-02)"
10683,Fundstrat,01/01/2017,Private,@fundstrat,https://www.fundstrat.com/,17/04/2014,5518645,,,,New York,United States,Dover,United States,United States,Partial pivot,"152532500,193713700","Industry research, Business consulting",,TRUE,"Legal Name: Fundstrat Global Advisors, LLC."
10707,Bit Markets,01/07/2017,Private,,https://www.bit-markets.io/,01/01/2014,SL031616,,,,Scotland,United Kingdom,Scotland,United Kingdom,United Kingdom,Native,101001000,Order-book,,TRUE,Owned by Amberfell Today LP Hqed in Scotland UK
10708,Coinschedule,01/01/2016,Private,@coinschedule,https://www.coinschedule.com/,19/01/2018,11158908,,,,Oxford,United Kingdom,Rickmansworth,United Kingdom,United Kingdom,Native,"152512302,152522400,162822801","News Aggregator, Rating,Event schedule","2017-01-01:12;
2018-01-01:2",TRUE,
10710,Woleet,01/04/2016,Private,@woleet,,01/04/2016,,,,,Rennes,France,Rennes,France,France,Native,204003901,Timestamping Service,,TRUE,
